supplier_url,supplier_name,rating
https://brt4u.en.alibaba.com/company_profile.html#top-nav-bar,"Ningbo BRT Imp. & Exp. Co., Ltd.,Supplier",4.8
https://vanfond.en.alibaba.com/company_profile.html#top-nav-bar,"Hangzhou Vanfond Import & Export Co., Ltd.,Supplier",4.8
https://richholy.en.alibaba.com/company_profile.html#top-nav-bar,"Changsha Fusheng Trade Co., Ltd.",5.0
https://yespens.en.alibaba.com/company_profile.html#top-nav-bar,"Tonglu Yaqi Stationery Co., Ltd.,Supplier",4.9
https://kueensind.en.alibaba.com/company_profile.html#top-nav-bar,"Shanghai Kueens Industrial Co., Ltd.",5.0
https://cywh.en.alibaba.com/company_profile.html#top-nav-bar,"Jiangxi Changyin Culture Gift Co., Ltd.",
https://s-way.en.alibaba.com/company_profile.html#top-nav-bar,,
https://youngdtl.en.alibaba.com/company_profile.html#top-nav-bar,"Shenzhen Youya Gift Co., Ltd.",4.2
https://jshoryen.en.alibaba.com/company_profile.html#top-nav-bar,"Jiangsu Horyen International Trade Co., Ltd.",5.0
https://pinboplastic.en.alibaba.com/company_profile.html#top-nav-bar,"Ningbo Pinbo Plastic Manufactory Co., Ltd.,Supplier",4.7
https://boschpen.en.alibaba.com/company_profile.html#top-nav-bar,Nanchang Bosch Pen Factory,4.5
https://xinghaopen.en.alibaba.com/company_profile.html#top-nav-bar,"Nanchang Xinghaopen Company Limited,Supplier",4.8
https://yashiya.en.alibaba.com/company_profile.html#top-nav-bar,"Yuyao Asia Stationery Manufacturing Co., Ltd.",4.6
https://jxkeda.en.alibaba.com/company_profile.html#top-nav-bar,"Nanchang Keda Stationery Gifts Industrial Co., Ltd.",4.7
https://ningbostyle.en.alibaba.com/company_profile.html#top-nav-bar,"Ningbo Style Stationery Co., Ltd.",4.8
https://tohomgift.en.alibaba.com/company_profile.html#top-nav-bar,"Shenzhen Tohom Gift Co., Ltd.",4.8
https://giftline.en.alibaba.com/company_profile.html#top-nav-bar,"Yiwu Giftline Import & Export Co., Ltd.",5.0
https://vanfond2.en.alibaba.com/company_profile.html#top-nav-bar,"Hangzhou Vanfond Import & Export Co., Ltd.",4.4
https://jacob.en.alibaba.com/company_profile.html#top-nav-bar,"Wenzhou Jacob Imp. & Exp. Co., Ltd.",4.9
https://zjnanbei.en.alibaba.com/company_profile.html#top-nav-bar,"Zhejiang Nanbei Trading Co., Ltd.",5.0
https://fo-color.en.alibaba.com/company_profile.html#top-nav-bar,"Qingdao Focus On Color Industry & Trade Co., Ltd.",4.6
https://sunlightexport.en.alibaba.com/company_profile.html#top-nav-bar,"Yiwu Sunlight Import & Export Co., Ltd.",
https://twinswin.en.alibaba.com/company_profile.html#top-nav-bar,"Yiwu Twins Win Import & Export Co., Ltd.",4.7
https://juzegift.en.alibaba.com/company_profile.html#top-nav-bar,"Yiwu Juze Trading Co., Ltd.",
https://kslifeng.en.alibaba.com/company_profile.html#top-nav-bar,"Kunshan Lifeng Arts And Crafts Co., Ltd.,Supplier",4.8
https://ljk.en.alibaba.com/company_profile.html#top-nav-bar,"Shanghai Rbin Industry And Trade Co., Ltd.",4.8
https://nbjbt.en.alibaba.com/company_profile.html#top-nav-bar,"Ningbo Everbest Stationery And Promotional Co., Ltd.",5.0
https://hjpen.en.alibaba.com/company_profile.html#top-nav-bar,"Nanchang Haojun Stationery Co., Ltd.",4.9
https://macropai.en.alibaba.com/company_profile.html#top-nav-bar,"Dongguan Artsky Stationery Co., Ltd.",4.8
https://yishangcrafts.en.alibaba.com/company_profile.html#top-nav-bar,"Zhongshan Yishang Crafts Co., Ltd.",
https://enpaipromotion.en.alibaba.com/company_profile.html#top-nav-bar,"Hangzhou Enpai Trading Co., Ltd.",
https://ywzhuidian.en.alibaba.com/company_profile.html#top-nav-bar,"Yiwu Top Speed Trade Co., Ltd.",
https://ttxpens.en.alibaba.com/company_profile.html#top-nav-bar,Jinxian Tian Tian Xing Pens Manufactory,4.6
https://penglai.en.alibaba.com/company_profile.html#top-nav-bar,"Nanchang Penglai Industrial Co., Ltd.",4.6
https://writing-top.en.alibaba.com/company_profile.html#top-nav-bar,"Changshu Writing Top Imp. & Exp. Co., Ltd.",0.0
https://yongyigifts.en.alibaba.com/company_profile.html#top-nav-bar,"Yiwu Yongyi Import & Export Co., Ltd.",5.0
https://hystationery.en.alibaba.com/company_profile.html#top-nav-bar,"Shenzhen Winjoy Stationery Co., Ltd.,Supplier",4.8
https://cnhuachuanpen.en.alibaba.com/company_profile.html#top-nav-bar,Tonglu Huachuan Pen Factory,4.8
https://sz-primegift.en.alibaba.com/company_profile.html#top-nav-bar,"Suzhou Prime Gifts Co., Ltd.,Supplier",4.8
https://sayoo.en.alibaba.com/company_profile.html#top-nav-bar,"Yiwu Sayoo Import And Export Co., Ltd.",5.0
https://pen.en.alibaba.com/company_profile.html#top-nav-bar,"Shenzhen 91 Ballpen Stationery Co., Ltd.",5.0
https://chinasholar.en.alibaba.com/company_profile.html#top-nav-bar,"Tonglu Scholar Stationery Co., Ltd.,Supplier",4.9
https://toppromotion.en.alibaba.com/company_profile.html#top-nav-bar,"Shenzhen Huayuan Fa Gifts Co., Ltd.",4.9
https://ecoway.en.alibaba.com/company_profile.html#top-nav-bar,"Yangzhou Ecoway Hotel Supply Co., Ltd.,Supplier",4.7
https://shishencarpet.en.alibaba.com/company_profile.html#top-nav-bar,"Yiwu Shishen Carpet Co., Ltd.",5.0
https://maxim1912.en.alibaba.com/company_profile.html#top-nav-bar,"Maxim Import And Export Co., Ltd.",5.0
https://huachuanpen.en.alibaba.com/company_profile.html#top-nav-bar,Tonglu Huachuan Pen Factory,4.6
https://blossomoffice.en.alibaba.com/company_profile.html#top-nav-bar,Suzhou Blossom Business Limited,4.8
https://ttxpen.en.alibaba.com/company_profile.html#top-nav-bar,"Jinxian Tian Tian Xing Pens Manufactory,Supplier",4.7
https://smilestationery.en.alibaba.com/company_profile.html#top-nav-bar,,
https://hamorlcon.en.alibaba.com/company_profile.html#top-nav-bar,,
https://miracletrading.en.alibaba.com/company_profile.html#top-nav-bar,"Ningbo Miracle International Trading Co., Ltd.",5.0
https://jk-promotional.en.alibaba.com/company_profile.html#top-nav-bar,"Quzhou Jikai Trading Co., Ltd.",5.0
https://simpleyoo.en.alibaba.com/company_profile.html#top-nav-bar,Yiwu Simpleyoo Stationery Factory,
https://gzjrc.en.alibaba.com/company_profile.html#top-nav-bar,"Guangzhou Kasun Stationery Co., Ltd.",4.9
https://abenec.en.alibaba.com/company_profile.html#top-nav-bar,"Hangzhou Aben E-Commerce Co., Ltd.",4.9
https://fyjpen.en.alibaba.com/company_profile.html#top-nav-bar,"Shenzhen Fengyaji Stationery & Gift Co., Ltd.",
https://nchlpen.en.alibaba.com/company_profile.html#top-nav-bar,,
https://kaihongyu.en.alibaba.com/company_profile.html#top-nav-bar,,
https://tongluborun.en.alibaba.com/company_profile.html#top-nav-bar,"Hangzhou Tonglu BoRun Import & Export Co., Ltd.",4.3
https://gzwsp.en.alibaba.com/company_profile.html#top-nav-bar,"Guangzhou Wensheng Stationery Co., Ltd.",4.8
https://hzlangchi.en.alibaba.com/company_profile.html#top-nav-bar,"Hangzhou Langchi Imp. & Exp. Co., Ltd.",4.8
https://qimiaogift.en.alibaba.com/company_profile.html#top-nav-bar,"Suzhou Amazing Gift Co., Ltd.,Supplier",5.0
https://gracepromotion.en.alibaba.com/company_profile.html#top-nav-bar,"Yiwu JC Import & Export Co., Ltd.",4.7
https://myang.en.alibaba.com/company_profile.html#top-nav-bar,"Ningbo Jiangbei Meiyang I & E Co., Ltd.",5.0
https://omailun.en.alibaba.com/company_profile.html#top-nav-bar,"Jiangxi Omailun Import & Export Co., Ltd.",4.6
https://lisengift.en.alibaba.com/company_profile.html#top-nav-bar,"Tonglu Lisen Stationery Gift Co., Ltd.,Supplier",4.8
https://hlpen.en.alibaba.com/company_profile.html#top-nav-bar,"Nanchang Valin Pen Industry Co., Ltd.",0.0
https://prowida.en.alibaba.com/company_profile.html#top-nav-bar,"Hangzhou Prowida Import & Export Co., Ltd.",5.0
https://cmb.en.alibaba.com/company_profile.html#top-nav-bar,"Shanghai Cmb Import And Export Co., Ltd.,Supplier",5.0
https://canaryjewelry.en.alibaba.com/company_profile.html#top-nav-bar,"Yiwu Be Creative Arts & Crafts Co., Ltd.",5.0
https://eachstationery.en.alibaba.com/company_profile.html#top-nav-bar,"Yiwu Each Stationery Co., Ltd.",5.0
https://beifagroup.en.alibaba.com/company_profile.html#top-nav-bar,"Beifa Group Co., Ltd.,Supplier",4.9
https://allwinpromos.en.alibaba.com/company_profile.html#top-nav-bar,"Yiwu Allwin Imp & Exp Co., Ltd.",4.9
https://brilliantimageproducts.en.alibaba.com/company_profile.html#top-nav-bar,"Suzhou Brilliant Image Business Co., Ltd.",5.0
https://redheartbag.en.alibaba.com/company_profile.html#top-nav-bar,"Quanzhou Redheartbag Co., Ltd.",5.0
https://grassfit.en.alibaba.com/company_profile.html#top-nav-bar,"Grassfit Tech (Chengdu) Co., Ltd.",4.7
https://chinachxing.en.alibaba.com/company_profile.html#top-nav-bar,Xinji City Changxing Plastic Machine Factory,4.7
https://timecreate.en.alibaba.com/company_profile.html#top-nav-bar,"Ningbo Time-Create Fitness Equipment Co., Ltd.",5.0
https://danlinsport.en.alibaba.com/company_profile.html#top-nav-bar,"Binzhou Danlin Sports Goods Co., Ltd.",
https://qlhtoys.en.alibaba.com/company_profile.html#top-nav-bar,"Yiwu QLH Import And Export Co., Ltd.",4.8
https://everisefitness.en.alibaba.com/company_profile.html#top-nav-bar,"Suzhou Everise Fitness Co., Ltd.,Supplier",5.0
https://seawinchina.en.alibaba.com/company_profile.html#top-nav-bar,"Yiwu Senheng Eco-Technologies Co., Ltd.",5.0
https://styuansheng.en.alibaba.com/company_profile.html#top-nav-bar,"Shantou Chenghai Yuansheng Toys Industry Co., Ltd.",0.0
https://china-lanyard.en.alibaba.com/company_profile.html#top-nav-bar,"Fuzhou Dachion Import&Export Co., Ltd.,Supplier",5.0
https://yisencrafts.en.alibaba.com/company_profile.html#top-nav-bar,"Yiwu Yisen Arts & Crafts Co., Ltd.",5.0
https://boaosport.en.alibaba.com/company_profile.html#top-nav-bar,"Baoding Boao PS Equipment Co., Ltd.",3.7
https://chenhangmould.en.alibaba.com/company_profile.html#top-nav-bar,"Taizhou Huangyan Chenhang Mould Factory,Supplier",5.0
https://hzsaint.en.alibaba.com/company_profile.html#top-nav-bar,"Hangzhou Saint Glory Hometextile Co., Ltd.,Supplier",5.0
https://savvydeco.en.alibaba.com/company_profile.html#top-nav-bar,"Hangzhou Monad Fabrics Co., Ltd.,Supplier",4.8
https://chinaoulai.en.alibaba.com/company_profile.html#top-nav-bar,"Nantong Oulai Trading Co., Ltd.",4.7
https://zjsmashing.en.alibaba.com/company_profile.html#top-nav-bar,"Ningbo Simaixin International Trade Co., Ltd.",5.0
https://qdshengtextile.en.alibaba.com/company_profile.html#top-nav-bar,Qingdao Shengsheng Textile Company Limited,5.0
https://chinafinery.en.alibaba.com/company_profile.html#top-nav-bar,"Hangzhou San Hao Apparel&Accessory Co., Ltd.,Supplier",4.8
https://txkx.en.alibaba.com/company_profile.html#top-nav-bar,"Zhejiang Moncanol Home Textiles Co., Ltd.,Supplier",
https://beyoungdevelopment.en.alibaba.com/company_profile.html#top-nav-bar,"Ningbo Beyoung Development Co., Ltd.",5.0
https://lifediary.en.alibaba.com/company_profile.html#top-nav-bar,"Yangzhou SCS Hometextile Co., Ltd.,Supplier",5.0
https://lenwave.en.alibaba.com/company_profile.html#top-nav-bar,"Zhejiang Lenwave Sporting Goods Co., Ltd.,Supplier",4.9
https://yaoyue.en.alibaba.com/company_profile.html#top-nav-bar,"Yiwu Shenghui Jewelry Co., Ltd.",4.9
https://renfook.en.alibaba.com/company_profile.html#top-nav-bar,"Guangzhou Renfook Trade Co., Ltd.",4.7
https://scmi.en.alibaba.com/company_profile.html#top-nav-bar,"Shanxi Century Metal Industries Inc.,Supplier",5.0
https://sorter.en.alibaba.com/company_profile.html#top-nav-bar,,
https://pandahall.en.alibaba.com/company_profile.html#top-nav-bar,"Pandahall Jewelry Technology Co., Ltd.,Supplier",4.9
https://beads.en.alibaba.com/company_profile.html#top-nav-bar,Guangzhou Milky Way Jewelry Limited,4.8
https://linsoirbeads.en.alibaba.com/company_profile.html#top-nav-bar,"Yiwu Lingsai Jewelry Co., Ltd.,Supplier",4.7
https://zhuochengwj.en.alibaba.com/company_profile.html#top-nav-bar,"Wuxi Zhuocheng Mechanical Components Co., Ltd.,Supplier",5.0
https://yukai-precision.en.alibaba.com/company_profile.html#top-nav-bar,"Dongguan Yukai Precision Industry Co., Ltd.",4.6
https://ltxmarine.en.alibaba.com/company_profile.html#top-nav-bar,"Xiamen Sunshine Marine Co., Ltd.",5.0
https://weizhite.en.alibaba.com/company_profile.html#top-nav-bar,Yuyao Weizhite Hardware Electrical Appliance Factory,4.9
https://pxzy.en.alibaba.com/company_profile.html#top-nav-bar,"Pingxiang Zhongying Packing Co., Ltd.,Supplier",4.8
https://dreamlandplayground.en.alibaba.com/company_profile.html#top-nav-bar,"Yongjia Dreamland Playground Factory,Supplier",5.0
https://gzyiqile.en.alibaba.com/company_profile.html#top-nav-bar,"Guangzhou Yiqile Education And Recreation Equipment Co., Ltd.,Supplier",5.0
https://summer-suntech.en.alibaba.com/company_profile.html#top-nav-bar,"Suntech International Trading (Wuhan) Co., Ltd.",0.0
https://libenplay.en.alibaba.com/company_profile.html#top-nav-bar,"Liben Group Wenzhou Toy Co., Ltd.",5.0
https://xdsyy.en.alibaba.com/company_profile.html#top-nav-bar,"Shenyang Modern Gardening Landscape Engineering Co., Ltd.",5.0
https://homeartsindia.trustpass.alibaba.com/company_profile.html#top-nav-bar,HOME ARTS,
https://gxql.en.alibaba.com/company_profile.html#top-nav-bar,"Guangxi Qinglong Chemical Building Materials Co., Ltd.",
https://sedsl.en.alibaba.com/company_profile.html#top-nav-bar,"Taizhou Shengerda Plastic Co., Ltd.,Supplier",5.0
https://ipraise.en.alibaba.com/company_profile.html#top-nav-bar,"Foshan Ipraise Metal Products Co., Ltd.",4.8
https://theleointernational.trustpass.alibaba.com/company_profile.html#top-nav-bar,THE LEO INTERNATIONAL,
https://redeagle.en.alibaba.com/company_profile.html#top-nav-bar,Shenzhen Longgang Yuanshan Hongzhiying Artware Factory,
https://arcexport.trustpass.alibaba.com/company_profile.html#top-nav-bar,ARC EXPORT,
https://fobxiamen.en.alibaba.com/company_profile.html#top-nav-bar,"Amoy Crafts Co., Ltd.,Supplier",0.0
https://homegarden.en.alibaba.com/company_profile.html#top-nav-bar,"Shenzhen Yelin Technology Co., Ltd.",5.0
https://jiayungift.en.alibaba.com/company_profile.html#top-nav-bar,"Zhuji City Jiayun Crafts Co., Ltd.",5.0
https://samesun.en.alibaba.com/company_profile.html#top-nav-bar,"Xi'an Meilun Art & Crafts Co., Ltd.",4.8
https://zhonglidacnc.en.alibaba.com/company_profile.html#top-nav-bar,,
https://hametal.en.alibaba.com/company_profile.html#top-nav-bar,"Zhuhai Hengan Metal Products Co., Ltd.",
https://weixinmold.en.alibaba.com/company_profile.html#top-nav-bar,"Dongguan Xiangze Precision Mold Accessories Co., Ltd.",5.0
https://sunrix.en.alibaba.com/company_profile.html#top-nav-bar,"Suzhou Sunrix Precision Tools Co., Ltd.",5.0
https://forestwatches.en.alibaba.com/company_profile.html#top-nav-bar,"Shenzhen Forest Watches Co., Ltd.",4.8
https://wanku.en.alibaba.com/company_profile.html#top-nav-bar,"Guangzhou Wanku Watch Technology Development Co., Ltd.",4.8
https://wzywatch.en.alibaba.com/company_profile.html#top-nav-bar,"Guangzhou WZY Trading Co., Ltd.",4.6
https://szkoda.en.alibaba.com/company_profile.html#top-nav-bar,"Shenzhen Koda Horologe Co., Ltd.",
https://huangrun-watches.en.alibaba.com/company_profile.html#top-nav-bar,"Shenzhen Huangrun Technology Co., Limited",
https://gzlemon.en.alibaba.com/company_profile.html#top-nav-bar,"Guangzhou Lemon Trade Co., Ltd.",5.0
https://kdby.en.alibaba.com/company_profile.html#top-nav-bar,"Shenzhen Koda Horologe Co., Ltd.,Supplier",5.0
https://lybozhun.en.alibaba.com/company_profile.html#top-nav-bar,"Luoyang Bozhun Trade Co., Ltd.",5.0
https://hopearl.en.alibaba.com/company_profile.html#top-nav-bar,"Guangzhou FOOKYU Jewelry Co., Ltd.",4.6
https://shxuante.en.alibaba.com/company_profile.html#top-nav-bar,"Shanghai Skilt Machinery Equipment Co., Ltd.,Supplier",4.9
https://meticamachinery.en.alibaba.com/company_profile.html#top-nav-bar,"Metica Machinery (Shanghai) Co., Ltd.,Supplier",
https://higee.en.alibaba.com/company_profile.html#top-nav-bar,"Higee Machinery (Shanghai) Co., Ltd.,Supplier",5.0
https://hnxuanhua.en.alibaba.com/company_profile.html#top-nav-bar,"Henan Xuanhua Imp. & Exp. Trading Co., Ltd.",5.0
https://rifumachine.en.alibaba.com/company_profile.html#top-nav-bar,"Guangzhou Rifu Packaging Machinery Co., Ltd.,Supplier",5.0
https://huanlianauto.en.alibaba.com/company_profile.html#top-nav-bar,"Dongguan Huanlian Automation Equipment Co., Ltd.",4.9
https://shtianquan.en.alibaba.com/company_profile.html#top-nav-bar,"Shanghai Tianquan Packing Machinery Co., Ltd.",
https://yimupack.en.alibaba.com/company_profile.html#top-nav-bar,"Shanghai Yimu Machinery Co., Ltd.",5.0
https://cnqiancheng.en.alibaba.com/company_profile.html#top-nav-bar,"Shanghai Qiancheng Machinery Co., Ltd.",
https://promoadviser.en.alibaba.com/company_profile.html#top-nav-bar,"Suzhou Louis Yunsheng Trading Co., Ltd.,Supplier",5.0
https://frasun.en.alibaba.com/company_profile.html#top-nav-bar,"Beijing Frasun Technology Development Co., Ltd.",4.1
https://l-w.en.alibaba.com/company_profile.html#top-nav-bar,"Shenzhen Light World (Jewelry) Technology Co., Limited",4.6
https://ahjygm.en.alibaba.com/company_profile.html#top-nav-bar,"Anhui Sunshine Stationery Co., Ltd.",
https://jingroup.en.alibaba.com/company_profile.html#top-nav-bar,"Jin Jian International Trading (Shanghai) Co., Ltd.",
https://prostar-pen.en.alibaba.com/company_profile.html#top-nav-bar,"Hangzhou Prostar Enterprises Ltd.,Supplier",5.0
https://cloudsweet.en.alibaba.com/company_profile.html#top-nav-bar,"Fuzhou Cloud Sweet Trade Co., Limited,Supplier",5.0
https://qingdaomerit.en.alibaba.com/company_profile.html#top-nav-bar,"Qingdao Merit Prime Crafts Co., Ltd.",4.7
https://henyatech.en.alibaba.com/company_profile.html#top-nav-bar,"Shenzhen Henya Technology Co., Ltd.",
https://easy18.en.alibaba.com/company_profile.html#top-nav-bar,Guangzhou Easy Import And Export Ltd.,4.9
https://in1197708895fyqz.trustpass.alibaba.com/company_profile.html#top-nav-bar,PRIMESONS TECHTRADE PRIVATE LIMITED,
https://nbhxcraft.en.alibaba.com/company_profile.html#top-nav-bar,"Ningbo Haoxuan Crafts Co., Ltd.",4.9
https://felixes.en.alibaba.com/company_profile.html#top-nav-bar,"Anhui Baojia Impex Co., Ltd.",5.0
https://libaoke.en.alibaba.com/company_profile.html#top-nav-bar,Guangzhou Liwan Libaoke Stationery Leather Goods Firm,3.9
https://pingloy.en.alibaba.com/company_profile.html#top-nav-bar,"Kunshan Pinglory Gifts Co., Ltd.",4.9
https://nhbaihong.en.alibaba.com/company_profile.html#top-nav-bar,"Ningbo Ninghai Baihong Int'l Trade Co., Ltd.",
https://dingdianwenju.en.alibaba.com/company_profile.html#top-nav-bar,"Tonglu Dingdian Stationery Manufacturing Co., Ltd.",5.0
https://boomeranghkco.en.alibaba.com/company_profile.html#top-nav-bar,Boomerang (H.K.) Company,
https://ercpackaging.trustpass.alibaba.com/company_profile.html#top-nav-bar,E.R. CORNISH PTY LTD,
https://huadongtoy.en.alibaba.com/company_profile.html#top-nav-bar,"Huadong Entertainment Equipment Co., Ltd.,Supplier",5.0
https://justfuninflatables.en.alibaba.com/company_profile.html#top-nav-bar,"Zhengzhou Justfun Sports & Leisure Co., Ltd.",5.0
https://zzwinsun.en.alibaba.com/company_profile.html#top-nav-bar,"Zhengzhou Winsun Amusement Equipment Co., Ltd.",5.0
https://b-loong.en.alibaba.com/company_profile.html#top-nav-bar,"Jiangxi Eloong Environmental Technology Co., Ltd.",4.5
https://barry.en.alibaba.com/company_profile.html#top-nav-bar,"Guangzhou Barry Industrial Co., Ltd.",4.9
https://cngreatbuy.en.alibaba.com/company_profile.html#top-nav-bar,"Shenzhen GreatBuy Technology Co., Ltd.",4.4
https://supeiplay.en.alibaba.com/company_profile.html#top-nav-bar,"Shenzhen Supei Playground Equipment Technology Co., Ltd.",5.0
https://jbell.en.alibaba.com/company_profile.html#top-nav-bar,"Wenzhou J&Bell Amusement Equipment Co., Ltd.,Supplier",5.0
https://jd-trade.en.alibaba.com/company_profile.html#top-nav-bar,,
https://pandaplay.en.alibaba.com/company_profile.html#top-nav-bar,"Wenzhou Panda Amusement Equipment Co., Ltd.",5.0
https://gztrust.en.alibaba.com/company_profile.html#top-nav-bar,"Guangzhou Trust Trade Co., Ltd.",4.4
https://startinal.en.alibaba.com/company_profile.html#top-nav-bar,"Wenzhou Startinal Toy Co., Ltd.",5.0
https://carkilo.en.alibaba.com/company_profile.html#top-nav-bar,Yongjia Qiaoxia Town Mingway Ocean Ball Factory,5.0
https://bsdtoys.en.alibaba.com/company_profile.html#top-nav-bar,"Wenzhou Bosda Amusement Equipment Co., Ltd.",3.3
https://domerry.en.alibaba.com/company_profile.html#top-nav-bar,"Guangzhou Domerry Amusement Equipment Co., Ltd.,Supplier",5.0
https://hnwenxiang.en.alibaba.com/company_profile.html#top-nav-bar,"Henan Wenxiang Import & Export Trading Co., Ltd.",4.9
https://datongextruder.en.alibaba.com/company_profile.html#top-nav-bar,"Jinan Datong Machinery Co., Ltd.,Supplier",5.0
https://belyoo.en.alibaba.com/company_profile.html#top-nav-bar,"Henan Belyoo Machinery Co., Ltd.",4.6
https://goldenmachine.en.alibaba.com/company_profile.html#top-nav-bar,"Luohe Golden Shell Mechanical Equipment Co., Ltd.",4.7
https://zzwanto.en.alibaba.com/company_profile.html#top-nav-bar,"Zhengzhou Wantuo Import And Export Co., Ltd.",5.0
https://zzshuliy.en.alibaba.com/company_profile.html#top-nav-bar,"Zhengzhou Shuliy Machinery Co., Ltd.",0.0
https://shuli.en.alibaba.com/company_profile.html#top-nav-bar,"Zhengzhou Shuliy Machinery Co., Ltd.",5.0
https://hento.en.alibaba.com/company_profile.html#top-nav-bar,"Zhengzhou Hento Machinery Co., Ltd.",5.0
https://maisheng.en.alibaba.com/company_profile.html#top-nav-bar,Henan Machinery & Equipment Company Limited,1.7
https://topp.en.alibaba.com/company_profile.html#top-nav-bar,"Henan Topp Machinery Co., Ltd.",5.0
https://ejinshi.en.alibaba.com/company_profile.html#top-nav-bar,"Hebei Jinshi Industrial Metal Co., Ltd.,Supplier",4.1
https://efs.en.alibaba.com/company_profile.html#top-nav-bar,"EFS Furniture Co., Ltd.",
https://celia.en.alibaba.com/company_profile.html#top-nav-bar,"Hangzhou Celia Hardware Co., Ltd.",4.7
https://qingyungongmao.en.alibaba.com/company_profile.html#top-nav-bar,"Nanpi Qingyun Industry And Trade Co., Ltd.",5.0
https://cnweifeng.en.alibaba.com/company_profile.html#top-nav-bar,"Wei Feng (Tianjin) International Trading Co., Ltd.",0.0
https://saitong.en.alibaba.com/company_profile.html#top-nav-bar,"Hangzhou Saitong Import & Export Co., Ltd.",5.0
https://ykdr.en.alibaba.com/company_profile.html#top-nav-bar,"Zhejiang Dongrun Casting Industry Co., Ltd.,Supplier",5.0
https://jinnaike.en.alibaba.com/company_profile.html#top-nav-bar,"Jiaxing Jinnaike Hardware Products Co., Ltd.,Supplier",5.0
https://aqua.en.alibaba.com/company_profile.html#top-nav-bar,"Suntex Metals Co., Ltd.",
https://hiboleather.en.alibaba.com/company_profile.html#top-nav-bar,"Guangzhou HIBO Industries Co., Ltd.,Supplier",5.0
https://tianyibag.en.alibaba.com/company_profile.html#top-nav-bar,"Fujian Quanzhou Tianyi Bags Co., Ltd.",5.0
https://saivlon.en.alibaba.com/company_profile.html#top-nav-bar,Dongguan Saivlon Sports Goods Limited,
https://ywaifan.en.alibaba.com/company_profile.html#top-nav-bar,"Yiwu Aifan Bags Co., Ltd.",4.9
https://diasoutdoorsports.en.alibaba.com/company_profile.html#top-nav-bar,"Guangzhou Dias Outdoor Sports Co., Ltd.",4.5
https://accenturebio.en.alibaba.com/company_profile.html#top-nav-bar,"Xi'an Accenture Biological Technology Co., Ltd.",4.4
https://wonderfulherb.en.alibaba.com/company_profile.html#top-nav-bar,"Xi'an Wonderful Herb Biotechnology Co., Ltd.",4.7
https://hubeiawks.en.alibaba.com/company_profile.html#top-nav-bar,"Hubei Aoks Trade Co., Ltd.,Supplier",4.9
https://vdeltadept4.trustpass.alibaba.com/company_profile.html#top-nav-bar,"VIET D.E.L.T.A INDUSTRIAL CO., LTD",
https://geekee01.en.alibaba.com/company_profile.html#top-nav-bar,"Xi'an Geekee Biotech Co., Ltd.",4.9
https://sdfelicity.en.alibaba.com/company_profile.html#top-nav-bar,"Jinan Felicity Biotechnology Co., Ltd.",4.0
https://sgonekbio1.en.alibaba.com/company_profile.html#top-nav-bar,"Xi'an Sgonek Biological Technology Co., Ltd.",4.3
https://geekee.en.alibaba.com/company_profile.html#top-nav-bar,"Xi'an Geekee Biotech Co., Ltd.",4.8
https://henrikang.en.alibaba.com/company_profile.html#top-nav-bar,"Xi'an Henrikang Biotech Co., Ltd.",4.9
https://shancaobio.en.alibaba.com/company_profile.html#top-nav-bar,"Xi'an Shancao Biological Technology Co., Ltd.",
https://zzxmjx.en.alibaba.com/company_profile.html#top-nav-bar,Zhengzhou Zhongzhou Briquette Machinery Plant,
https://bedo.en.alibaba.com/company_profile.html#top-nav-bar,"Henan Bedo Machinery Equipment Co., Ltd.",
https://hengyimachine.en.alibaba.com/company_profile.html#top-nav-bar,"Henan Hengyi Heavy Industry Equipment Co., Ltd.",5.0
https://zzzyjx.en.alibaba.com/company_profile.html#top-nav-bar,"Zhengzhou Zhengyang Machinery Equipment Co., Ltd.",4.1
https://alchemyfood.en.alibaba.com/company_profile.html#top-nav-bar,"Henan Alchemy Food Co., Ltd.",5.0
https://yuximachine.en.alibaba.com/company_profile.html#top-nav-bar,"Zhengzhou Yuxi Machinery Equipment Co., Ltd.",5.0
https://shuliy.en.alibaba.com/company_profile.html#top-nav-bar,"Zhengzhou Shuliy Machinery Co., Ltd.",4.0
https://china-fuxun.en.alibaba.com/company_profile.html#top-nav-bar,"Zhengzhou Fusion Machinery Equipment Co., Ltd.",5.0
https://coffsports.trustpass.alibaba.com/company_profile.html#top-nav-bar,COFF SPORTS,
https://srlohas.en.alibaba.com/company_profile.html#top-nav-bar,"SZ Lohas Silicone Rubber Co., Ltd.,Supplier",5.0
https://nchm.en.alibaba.com/company_profile.html#top-nav-bar,"Nanchang Hei Ma Sporting Goods Co., Ltd.",
https://superstartoys.en.alibaba.com/company_profile.html#top-nav-bar,"Yiwu Superstar Gift & Toys Co., Ltd.",5.0
https://hbtyty.en.alibaba.com/company_profile.html#top-nav-bar,"Henan Jumping Sports Goods Co., Ltd.",4.8
https://soccerequipment.en.alibaba.com/company_profile.html#top-nav-bar,Tianjin Soccer Sporting Goods Factory,
https://hnzldm.en.alibaba.com/company_profile.html#top-nav-bar,"Henan Zhonglian Demei Machinery Co., Ltd.",0.0
https://tengming.en.alibaba.com/company_profile.html#top-nav-bar,"Ma'anshan Tengming Technology Co., Ltd.",
https://qingdaobanaba.en.alibaba.com/company_profile.html#top-nav-bar,Qingdao Banaba Manufacture Tools Ltd.,
https://aslanmachinery.en.alibaba.com/company_profile.html#top-nav-bar,"Zhengzhou Aslan Machinery Co., Ltd.",
