supplier_url,supplier_name,rating
https://v-sintl.en.alibaba.com/company_profile.html#top-nav-bar,"Yiwu Shincoo Art & Crafts Co., Ltd.",4.9
https://ywfqzm.en.alibaba.com/company_profile.html#top-nav-bar,"Yiwu Fengqing Toy Co., Ltd.,Supplier",4.6
https://carqilight.en.alibaba.com/company_profile.html#top-nav-bar,"Guangzhou Carqilight Auto Parts Co., Ltd.",5.0
https://trutecled.en.alibaba.com/company_profile.html#top-nav-bar,"Guangzhou Trutec Auto Electronics Technology Co., Ltd.",
https://ftl666.en.alibaba.com/company_profile.html#top-nav-bar,"Beijing First & Topping Lighting Technology Co., Ltd.",
https://hyluxtek.en.alibaba.com/company_profile.html#top-nav-bar,Hylux Technology Corporation Ltd.,
https://techone.en.alibaba.com/company_profile.html#top-nav-bar,"Shenzhen Techone Tech Co., Ltd.",
https://gmhz.en.alibaba.com/company_profile.html#top-nav-bar,"Hangzhou Gigamega New Energy Tech Co., Ltd.",
https://noerka.en.alibaba.com/company_profile.html#top-nav-bar,"Ningbo Fenghua Noerka Lighting & Fixture Co., Ltd.",
https://lumencn.en.alibaba.com/company_profile.html#top-nav-bar,,
https://xenon.en.alibaba.com/company_profile.html#top-nav-bar,"Ningbo Zenyo Imp & Exp Co., Ltd.",
https://sreelight.en.alibaba.com/company_profile.html#top-nav-bar,"Shenzhen Sree Optoelectronic Technology Co., Ltd.",4.9
https://ledbesttube.en.alibaba.com/company_profile.html#top-nav-bar,"BENSON ENERGY SAVING TECHNOLOGY CO., LTD.",
https://betterlite.en.alibaba.com/company_profile.html#top-nav-bar,"Shenzhen Better Lighting Co., Ltd.",5.0
https://lhhilight.en.alibaba.com/company_profile.html#top-nav-bar,"Luohe Hilight Technology Co., Ltd.",3.0
https://li-light.en.alibaba.com/company_profile.html#top-nav-bar,Shaoxing Binhai Liaoyuan Lighting Electric Factory,5.0
https://infelite.en.alibaba.com/company_profile.html#top-nav-bar,"Shenzhen Infelite Co., Ltd.",5.0
https://ok-lite.en.alibaba.com/company_profile.html#top-nav-bar,"Shenzhen OK-lite Manufacturing Co., Ltd.",5.0
https://pufaled.en.alibaba.com/company_profile.html#top-nav-bar,"Shenzhen Pufa Energy Saving Lighting Technology Co., Ltd.",5.0
https://romanso.en.alibaba.com/company_profile.html#top-nav-bar,"Shenzhen Romanso Electronic Co., Ltd.",5.0
https://vlikelighting.en.alibaba.com/company_profile.html#top-nav-bar,"Shenzhen VLIKE Lighting Technology Co., Ltd.",4.8
https://popnow.en.alibaba.com/company_profile.html#top-nav-bar,"Guangzhou POPNOW Electronic Technology Co., Ltd.",4.4
https://yurao.en.alibaba.com/company_profile.html#top-nav-bar,"Guangzhou Yurao Import & Export Co., Ltd.",4.8
https://hid-led.en.alibaba.com/company_profile.html#top-nav-bar,"Guangzhou Boorin Car Accessories Co., Ltd.,Supplier",4.8
https://szokayhydroponics.en.alibaba.com/company_profile.html#top-nav-bar,"Shenzhen Okay Hydroponics Co., Ltd.",5.0
https://lightechled.en.alibaba.com/company_profile.html#top-nav-bar,"Guangzhou Lightech Lighting Co., Ltd.",5.0
https://b-deals.en.alibaba.com/company_profile.html#top-nav-bar,"Guangzhou B-Deals Electronic Technology Co., Ltd.",4.9
https://yylamps.en.alibaba.com/company_profile.html#top-nav-bar,"Guangzhou Yue Yu Electronic Co., Ltd.",4.7
https://nbjunyun.en.alibaba.com/company_profile.html#top-nav-bar,"Ningbo Junyun Lighting Electric Appliance Co., Ltd.",
https://townlite.en.alibaba.com/company_profile.html#top-nav-bar,Changzhou Newtown Special Bulb Factory,
https://kingratelighting.en.alibaba.com/company_profile.html#top-nav-bar,"Foshan Kingrate Optoelectronic Technology Co., Ltd.,Supplier",5.0
https://bersn.en.alibaba.com/company_profile.html#top-nav-bar,"Shenzhen BERSN Opto-Electronics Co., Ltd.",0.0
https://xingzhiye.en.alibaba.com/company_profile.html#top-nav-bar,"Shenzhen Xingzhiye Printing & Packing Co., Ltd.,Supplier",4.3
https://zgchangfa.en.alibaba.com/company_profile.html#top-nav-bar,Dongguan Changfa Packing Products Factory,5.0
https://wing.en.alibaba.com/company_profile.html#top-nav-bar,"Ningbo Wing Precision Machining Co., Ltd.,Supplier",5.0
https://bnchg.en.alibaba.com/company_profile.html#top-nav-bar,"Yueqing Bincheng Electronics Co., Ltd.",
https://chinaxqs.en.alibaba.com/company_profile.html#top-nav-bar,"Guangdong Xingpu Energy-Saving Light Co., Ltd.",0.0
https://spmlighting.en.alibaba.com/company_profile.html#top-nav-bar,"Shenzhen Spm Lighting Co., Ltd.,Supplier",5.0
https://enlightelectronics.en.alibaba.com/company_profile.html#top-nav-bar,"Huizhou Enlight Electronics Co., Ltd.",4.9
https://legelite.en.alibaba.com/company_profile.html#top-nav-bar,"Shenzhen Legelite Technology Co., Ltd.",
https://jiateming.en.alibaba.com/company_profile.html#top-nav-bar,"Foshan Jiateming Lighting Electrical Appliance Co., Ltd.",
https://szjiangjing.en.alibaba.com/company_profile.html#top-nav-bar,"Shenzhen Jiangjing Lighting Co., Ltd.,Supplier",4.7
https://focalvalue.en.alibaba.com/company_profile.html#top-nav-bar,"Shenzhen Focalvalue Technology Co., Ltd.",4.6
https://cnwingspeed.en.alibaba.com/company_profile.html#top-nav-bar,"Shenzhen Wingspeed International Forwarding Co., Ltd.,Supplier",5.0
https://longood.en.alibaba.com/company_profile.html#top-nav-bar,"Shenzhen Longood Intelligent Electric Co., Ltd.,Supplier",5.0
https://todaylogistic.en.alibaba.com/company_profile.html#top-nav-bar,"TODAY INTERNATIONAL LOGISTICS CO., LIMITED",4.4
https://bonmedshipping.en.alibaba.com/company_profile.html#top-nav-bar,"Shenzhen Wingspeed International Forwarding Co., Ltd.",4.9
https://lanseko.en.alibaba.com/company_profile.html#top-nav-bar,"LANSEKO (Guangzhou) Electronic Technology Co., Limited",5.0
https://raychtech.en.alibaba.com/company_profile.html#top-nav-bar,"Guangzhou Raych Electronic Technology Co., Ltd.",4.8
https://youstar.en.alibaba.com/company_profile.html#top-nav-bar,"Guangzhou Youstar Technology Co., Ltd.",4.7
https://zsmacarap.en.alibaba.com/company_profile.html#top-nav-bar,"Zhongshan Macar Auto Accessory Co., Ltd.",5.0
https://boorin.en.alibaba.com/company_profile.html#top-nav-bar,"Guangzhou Boorin Car Accessories Co., Ltd.",4.4
https://nbsy-dq.en.alibaba.com/company_profile.html#top-nav-bar,"Ningbo Shengyuan Electric Co., Ltd.",5.0
https://360autoparts.en.alibaba.com/company_profile.html#top-nav-bar,"Guangzhou Ouge Electronic Technology Co., Ltd.,Supplier",5.0
https://tide-star.en.alibaba.com/company_profile.html#top-nav-bar,"Yongkang Tengrun Electronics Co., Ltd.",4.4
https://milleniumgrowlight.en.alibaba.com/company_profile.html#top-nav-bar,"Shanghai Millenium Industry Co., Ltd.,Supplier",
https://new-lights.en.alibaba.com/company_profile.html#top-nav-bar,"Haining Xinguangyuan Lighting Technology Co., Ltd.,Supplier",4.9
https://cnlitech.en.alibaba.com/company_profile.html#top-nav-bar,"Zhejiang East Electric Co., Ltd.",
https://lampda.en.alibaba.com/company_profile.html#top-nav-bar,"Shenzhen Lampda Photoelectric Technology Co., Ltd.,Supplier",4.8
https://topsunlight.en.alibaba.com/company_profile.html#top-nav-bar,"Shenzhen Sunlight Lighting Co., Ltd.,Supplier",4.9
https://win-light.en.alibaba.com/company_profile.html#top-nav-bar,"Guangdong Winlight Energy-Saving Photoelectric Co., Ltd.",5.0
https://winnerlight.en.alibaba.com/company_profile.html#top-nav-bar,"Yiwu Winner Lighting Appliance Co., Ltd.",
https://intbright.en.alibaba.com/company_profile.html#top-nav-bar,"Ningbo Intbright Technology Co., Ltd.",5.0
https://yqmingbo.en.alibaba.com/company_profile.html#top-nav-bar,"Wenzhou Bozhou Marine Electric Co., Ltd.",5.0
https://cxvioletlighting.en.alibaba.com/company_profile.html#top-nav-bar,"Ningbo Violet Lighting Electric Co., Ltd.",5.0
https://jingmeidengju.en.alibaba.com/company_profile.html#top-nav-bar,"Shanghai Jingmei Lamps And Lanterns Co., Ltd.",
https://esource.en.alibaba.com/company_profile.html#top-nav-bar,"Zhongshan E-source Lighting Co., Ltd.",
https://kejiecn.en.alibaba.com/company_profile.html#top-nav-bar,"Kejie Electronic Co., Ltd.,Supplier",0.0
https://shendadj.en.alibaba.com/company_profile.html#top-nav-bar,"Suzhou Shenda Cleanroom Lighting Co., Ltd.",
https://shje.en.alibaba.com/company_profile.html#top-nav-bar,"Shanghai Jiyi Lighting Electric Engineering Co., Ltd.",
https://junlang.en.alibaba.com/company_profile.html#top-nav-bar,"Guangdong Junon Songtian Electrical Appliance Co., Ltd.",
https://szghy.en.alibaba.com/company_profile.html#top-nav-bar,"Shenzhen Guanhongya Optoelectronic Technology Co., Ltd.",5.0
https://nbyuanhui.en.alibaba.com/company_profile.html#top-nav-bar,"Cixi Yuanhui Lighting Electric Co., Ltd.",
https://bzdq.en.alibaba.com/company_profile.html#top-nav-bar,"Yangzhou Baozhu Electric Appliance Co., Ltd.",5.0
https://unigreensz.en.alibaba.com/company_profile.html#top-nav-bar,"Suzhou Unigreen Electronic Technology Co., Ltd.,Supplier",5.0
https://ait.en.alibaba.com/company_profile.html#top-nav-bar,,
https://tzmondial.en.alibaba.com/company_profile.html#top-nav-bar,"Taizhou Mondial Import And Export Co., Ltd.,Supplier",5.0
https://wxqiya.en.alibaba.com/company_profile.html#top-nav-bar,Wuxi Qiya Lighting And Electric Appliance Factory,
https://szrunpen.en.alibaba.com/company_profile.html#top-nav-bar,"Shenzhen Runpeng Precision Hardware Co., Ltd.,Supplier",5.0
https://dkybikes.en.alibaba.com/company_profile.html#top-nav-bar,Zhongshan Qiangli Electronic Factory,0.0
https://creatoruv.en.alibaba.com/company_profile.html#top-nav-bar,"Foshan Creator UV&IR Lighting Co., Ltd.",
https://cn1526605628xhdf.en.alibaba.com/company_profile.html#top-nav-bar,"Hangzhou Solid Electrical Equipment Co., Ltd.",
https://aykelektronik.trustpass.alibaba.com/company_profile.html#top-nav-bar,AYK ELEKTRONIK SANAYI VE DIS TICARET LIMITED SIRKETI,
https://cantonled.en.alibaba.com/company_profile.html#top-nav-bar,"Guangzhou Houde Electronic Technology Co., Ltd.",5.0
https://xchid.en.alibaba.com/company_profile.html#top-nav-bar,"Haining Xencon Light Source Technology Co., Ltd.",
https://unionlux.en.alibaba.com/company_profile.html#top-nav-bar,"Guangzhou Unionlux Lighting Co., Limited",4.7
https://exontek.en.alibaba.com/company_profile.html#top-nav-bar,,
https://ycautoparts.en.alibaba.com/company_profile.html#top-nav-bar,"Guangzhou Yangchi Autoparts Co., Ltd.",4.2
https://gzkuyang.en.alibaba.com/company_profile.html#top-nav-bar,"Guangzhou Kuyang Electronics Co., Ltd.",4.7
https://welyuun.en.alibaba.com/company_profile.html#top-nav-bar,"Guangzhou Wanmei Electronic Technology Co., Ltd.",5.0
https://matechid.en.alibaba.com/company_profile.html#top-nav-bar,"Guangzhou Matec Electronic Co., Ltd.,Supplier",4.8
https://gtelec.en.alibaba.com/company_profile.html#top-nav-bar,"Yueqing Guangtai Import & Export Co., Ltd.",5.0
https://smartgrowlight.en.alibaba.com/company_profile.html#top-nav-bar,"Huizhou HongYi Lighting Co., Ltd.",5.0
https://gzhelios.en.alibaba.com/company_profile.html#top-nav-bar,"Guangzhou Helios Electronics Technology Co., Ltd.",4.7
https://chinacmc.en.alibaba.com/company_profile.html#top-nav-bar,"Shenzhen Chengming Technologies Co., Ltd.",4.9
https://leno-tech.en.alibaba.com/company_profile.html#top-nav-bar,"Ningbo Leno Environment Tech Co., Ltd.",
https://zhpromotiongifts.en.alibaba.com/company_profile.html#top-nav-bar,"Jinhua Zhaohong Gifts & Crafts Co., Ltd.",5.0
https://haodatoy.en.alibaba.com/company_profile.html#top-nav-bar,"Shantou Chenghai Haoda Toys Co., Ltd.",4.8
https://sensterpkg.en.alibaba.com/company_profile.html#top-nav-bar,"Dongguan Senster Packaging Products Co., Ltd.",4.9
https://taxx.en.alibaba.com/company_profile.html#top-nav-bar,"Taian Xinxin Import & Export Co., Ltd.",5.0
https://harvestchannel.en.alibaba.com/company_profile.html#top-nav-bar,"Dongguan Jiujie Toys manufacturing Co.,Ltd.",5.0
https://dgchenghui.en.alibaba.com/company_profile.html#top-nav-bar,"Dongguan Hanxiang Rubber Products Co., Ltd.",5.0
https://yufengsz.en.alibaba.com/company_profile.html#top-nav-bar,"Yufeng Sports Products (Shenzhen) Co., Ltd.",4.6
https://perfectseeking.en.alibaba.com/company_profile.html#top-nav-bar,Dongguan Perfect Seeking Sports Product Limited,4.7
https://winsuntoys.en.alibaba.com/company_profile.html#top-nav-bar,"Zhengzhou Winsun Amusement Equipment Co., Ltd.",5.0
https://sezhicai.en.alibaba.com/company_profile.html#top-nav-bar,"Yiwu Sezhicai Ornaments Co., Ltd.",5.0
https://wxnlzc.en.alibaba.com/company_profile.html#top-nav-bar,Wuxi Nengli Bearing Company Limited,5.0
https://oilesbearing.en.alibaba.com/company_profile.html#top-nav-bar,"Jiashan PVB Sliding Bearing Co., Ltd.",4.2
https://habid.en.alibaba.com/company_profile.html#top-nav-bar,,
https://ntl-bearing.en.alibaba.com/company_profile.html#top-nav-bar,"Changsha Terry Machinery Co., Ltd.,Supplier",4.8
https://yws.en.alibaba.com/company_profile.html#top-nav-bar,"Jinan Yuki Bearing Co., Ltd.",4.9
https://jsaugman.en.alibaba.com/company_profile.html#top-nav-bar,"Jiashan Augman Machinery Co., Ltd.",5.0
https://shr-bearing.en.alibaba.com/company_profile.html#top-nav-bar,"Shanghai Shengyue Bearing Co., Ltd.",0.0
https://precisionsteelball.en.alibaba.com/company_profile.html#top-nav-bar,"Taian Hengda Steel Ball Co., Ltd.",
https://ball.en.alibaba.com/company_profile.html#top-nav-bar,"Shandong JinNai  International Trade Co., Ltd.",5.0
https://cngunri.en.alibaba.com/company_profile.html#top-nav-bar,"Dongguan Gunri Precision Hardware Co., Ltd.",5.0
https://junde-precision.en.alibaba.com/company_profile.html#top-nav-bar,Dongguan Qingxi Junde Mold Component Producing Shop,4.5
https://igs-bearing.en.alibaba.com/company_profile.html#top-nav-bar,"Changsha IGS Machinery Co., Ltd.",5.0
https://barbierichina.en.alibaba.com/company_profile.html#top-nav-bar,Chongqing Barbieri Machinery Manufacturing Limited Liability Company,
https://crestgolf.en.alibaba.com/company_profile.html#top-nav-bar,"Shenzhen Crestgolf Supplies Co., Ltd.",4.7
https://jcgolf.en.alibaba.com/company_profile.html#top-nav-bar,"Shenzhen J&C Golf Goods Co., Ltd.",4.9
https://solotoo.en.alibaba.com/company_profile.html#top-nav-bar,"Xiamen Solotoo Sporting Goods Co., Ltd.",4.8
https://lotusflower.en.alibaba.com/company_profile.html#top-nav-bar,"Ningbo Lotusflower Sport Equipments Co., Ltd.",5.0
https://xmdkalu.en.alibaba.com/company_profile.html#top-nav-bar,"Xiamen Dongke Aluminum Co., Ltd.",4.9
https://gostarsport.en.alibaba.com/company_profile.html#top-nav-bar,"Gostar Sporting Goods Co., Ltd.,Supplier",5.0
https://pesports.en.alibaba.com/company_profile.html#top-nav-bar,"Foshan Positive Energy Sports Development Co., Ltd.,Supplier",5.0
https://bestgolf.en.alibaba.com/company_profile.html#top-nav-bar,"Shenzhen Best Sports Products Co., Ltd.",
https://zysporting.en.alibaba.com/company_profile.html#top-nav-bar,"Yuyao Zhongyuan Plastic & Electrical Appliance Co., Ltd.",
https://fungreengolf.en.alibaba.com/company_profile.html#top-nav-bar,"Foshan Positive Energy Sports Development Co., Ltd.,Supplier",4.6
https://dksportbot.en.alibaba.com/company_profile.html#top-nav-bar,Dongguan Humen DKsportbot Factory,4.8
https://whqss.en.alibaba.com/company_profile.html#top-nav-bar,"Dongguan SIBOASI Sports Goods Technology Co., Ltd.",4.8
https://josone12.en.alibaba.com/company_profile.html#top-nav-bar,"Yiwu Huidong Industrial & Trade Co., Ltd.",4.1
https://xrhd-sport.en.alibaba.com/company_profile.html#top-nav-bar,"Tianjin Xurui Hengda International Trading Co., Ltd.",2.8
https://jintstar.en.alibaba.com/company_profile.html#top-nav-bar,Wuxi Jint International Trading Corp.,4.2
https://konmatsports.en.alibaba.com/company_profile.html#top-nav-bar,,
https://vintopsport.en.alibaba.com/company_profile.html#top-nav-bar,"Guangzhou Vintop Sporting Goods Co., Ltd.",
https://xupingparis.en.alibaba.com/company_profile.html#top-nav-bar,"Xuping Jewelry Co., Ltd.,Supplier",4.9
https://merryshine.en.alibaba.com/company_profile.html#top-nav-bar,"Shenzhen Merryshine Jewelry Co., Ltd.",4.9
https://cnmj.en.alibaba.com/company_profile.html#top-nav-bar,"Yiwu City MJ Jewelry Co., Ltd.,Supplier",4.5
https://tailuan.en.alibaba.com/company_profile.html#top-nav-bar,"Yiwu Tailuan Jewelry Co., Ltd.",4.8
https://yoyojewelry.en.alibaba.com/company_profile.html#top-nav-bar,"Shenzhen Sunrising Trade Co., Ltd.",4.9
https://jakcom.en.alibaba.com/company_profile.html#top-nav-bar,"Shanxi Jakcom Technology Co., Ltd.",4.4
https://zhenpingjewelry.en.alibaba.com/company_profile.html#top-nav-bar,"Dongguan Zhen Ping Jewelry Co., Ltd.,Supplier",4.6
https://landyjewelry.en.alibaba.com/company_profile.html#top-nav-bar,"Yiwu Landy Jewelry Co., Ltd.",4.9
https://avenajewellery.en.alibaba.com/company_profile.html#top-nav-bar,Dongguan Changda Jewellery Ltd.,4.9
https://charmfish.en.alibaba.com/company_profile.html#top-nav-bar,"Shenzhen Charm Fish Net Co., Ltd.",4.9
https://feelingjewelry.en.alibaba.com/company_profile.html#top-nav-bar,"Yiwu Feiling Jewelry Co., Ltd.",4.8
https://passionjewelry.en.alibaba.com/company_profile.html#top-nav-bar,"Yiwu Passion Jewelry Co., Ltd.",4.9
https://ywyaokai.en.alibaba.com/company_profile.html#top-nav-bar,"Yiwu Yaokai Jewelry Co., Ltd.",4.8
https://hklongway.en.alibaba.com/company_profile.html#top-nav-bar,"Yiwu Long Way Jewelry Co., Ltd.",4.7
https://shineyjewelry.en.alibaba.com/company_profile.html#top-nav-bar,Yiwu Yuzhe Jewelry Factory,4.5
https://mycraft.en.alibaba.com/company_profile.html#top-nav-bar,"Jinhua Meiyang Crafts Co., Ltd.",5.0
https://qingjiafireworks.en.alibaba.com/company_profile.html#top-nav-bar,"Liuyang Qingjia Fireworks Co., Ltd.",4.7
https://wacme.en.alibaba.com/company_profile.html#top-nav-bar,"Acme Technology (Zhejiang) Co., Ltd.",
https://fireworkshow.en.alibaba.com/company_profile.html#top-nav-bar,"Liuyang Dream Fireworks Manufacturing & Display Co., Ltd.",
https://phoenix-fireworks.en.alibaba.com/company_profile.html#top-nav-bar,"Liling New Times Trade Co., Ltd.",
https://globalfireworks.en.alibaba.com/company_profile.html#top-nav-bar,"Liuyang Global Supply Chain Service Co., Ltd.",
https://foampudg.en.alibaba.com/company_profile.html#top-nav-bar,Dongguan T&F Rubber-Plastic Electronic Materials Factory,5.0
https://lyxp-fireworks.en.alibaba.com/company_profile.html#top-nav-bar,"Liuyang XP Fireworks Co., Ltd.",
https://zsmingshi.en.alibaba.com/company_profile.html#top-nav-bar,"Guangdong Mingshi Plastic Technology Co., Ltd.",4.7
https://beluns.en.alibaba.com/company_profile.html#top-nav-bar,"Jiangxi Beluns Plastic Co., Ltd.",
https://jzcpu.en.alibaba.com/company_profile.html#top-nav-bar,,
https://fspengde.en.alibaba.com/company_profile.html#top-nav-bar,"Guangdong Pengde Rubber Plastic Co., Ltd.",0.0
https://naxilaico.en.alibaba.com/company_profile.html#top-nav-bar,"Guangzhou Naxilai Plastic Co., Ltd.",5.0
https://jhgcsl.en.alibaba.com/company_profile.html#top-nav-bar,,
https://chinaplas-material.en.alibaba.com/company_profile.html#top-nav-bar,"Shenzhen Chinaplas Material Co., Limited",
https://sjkpmma.en.alibaba.com/company_profile.html#top-nav-bar,"Foshan Jinggu Plastic Products Co., Ltd.",0.0
https://hzbeide.en.alibaba.com/company_profile.html#top-nav-bar,"Hangzhou Beide Mechanical And Electrical Equipment Co., Ltd.",
https://thunderman.en.alibaba.com/company_profile.html#top-nav-bar,"Shenzhen Thunderman Technology Co., Ltd.",5.0
https://tqbearing.en.alibaba.com/company_profile.html#top-nav-bar,"Tianjin Tengqi International Trade Co., Ltd.",5.0
https://czhuari.en.alibaba.com/company_profile.html#top-nav-bar,"Changzhou Huari Steel Ball Co., Ltd.,Supplier",5.0
https://ntn.en.alibaba.com/company_profile.html#top-nav-bar,,
https://zotyindustrial.en.alibaba.com/company_profile.html#top-nav-bar,"Dongguan Zoty Bearing Co., Ltd.",5.0
https://edlcaster.en.alibaba.com/company_profile.html#top-nav-bar,"Jiaxing Wedo Network Technology Co., Ltd.",4.8
https://pdmindustryfastener.en.alibaba.com/company_profile.html#top-nav-bar,"Qingdao Pengrui Machinery Co., Ltd.,Supplier",5.0
https://zchardware.en.alibaba.com/company_profile.html#top-nav-bar,"Dongguan Zhengchen Hardware Co., Limited",4.9
https://zskezhi.en.alibaba.com/company_profile.html#top-nav-bar,"Zhongshan Kezhi Metal Products Co., Ltd.",
https://gzkehang.en.alibaba.com/company_profile.html#top-nav-bar,Guangzhou Panyu Kehang Caster Factory,
https://hscdtech.en.alibaba.com/company_profile.html#top-nav-bar,"Beijing Haosheng Transmission Technology Co., Ltd.",
https://fsjameson.en.alibaba.com/company_profile.html#top-nav-bar,"Foshan Nanhai Jameson Caster Co., Ltd.",
https://bigbiz.en.alibaba.com/company_profile.html#top-nav-bar,"Qingdao Bigbiz Tire Co., Ltd.",
https://holopack.en.alibaba.com/company_profile.html#top-nav-bar,"HOLO PACK TECHNOLOGY CO., LTD.",
https://axelenterprises.trustpass.alibaba.com/company_profile.html#top-nav-bar,AXEL ENTERPRISES,
https://aomiao.en.alibaba.com/company_profile.html#top-nav-bar,"Guangzhou Aomiao Inflatable Co., Ltd.,Supplier",4.9
https://awfen.trustpass.alibaba.com/company_profile.html#top-nav-bar,AWFEN ENTERPRISES,
https://hthtoy.en.alibaba.com/company_profile.html#top-nav-bar,"Henan Hengtaihua Amusement Equipment Co., Ltd.,Supplier",5.0
https://dingopromo.en.alibaba.com/company_profile.html#top-nav-bar,"Jiangsu Dingo Import & Export Trading Co., Ltd.",4.9
https://everfriendpet.en.alibaba.com/company_profile.html#top-nav-bar,"Everfriend Pet Product Co., Ltd.",
https://sprubber.en.alibaba.com/company_profile.html#top-nav-bar,"Splendid Rubber Products (Shenzhen) Co., Ltd.",
https://maihua.en.alibaba.com/company_profile.html#top-nav-bar,"Xiamen Maihua Rubber Products Co., Ltd.",0.0
https://dingcheng188.en.alibaba.com/company_profile.html#top-nav-bar,"Xinxiang City Ding Cheng Rubber And Plastic Co., Ltd.",5.0
https://thinrpo.en.alibaba.com/company_profile.html#top-nav-bar,"Xiamen Xin Hua Bao Silicone Rubber Components Products Co., Ltd.,Supplier",
https://gzh.en.alibaba.com/company_profile.html#top-nav-bar,"Dongguan Guangzhihong Silicone Products Co., Ltd.",4.7
https://newayrubber.en.alibaba.com/company_profile.html#top-nav-bar,"Xiamen Neway Rubber & Plastic Products Co., Ltd.,Supplier",5.0
https://decok.en.alibaba.com/company_profile.html#top-nav-bar,"Guangzhou Decok Steel Ball Co., Ltd.,Supplier",4.8
https://mylon.en.alibaba.com/company_profile.html#top-nav-bar,"Ningbo Mylon Rubber & Plastic Co., Ltd.",4.9
https://gz-best.en.alibaba.com/company_profile.html#top-nav-bar,"Guangzhou Best Rubber & Plastic Co., Ltd.",4.3
https://soccer.en.alibaba.com/company_profile.html#top-nav-bar,"Shanghai Zhensheng Sports Goods Co., Ltd.",5.0
https://xxsports.en.alibaba.com/company_profile.html#top-nav-bar,"Cangzhou Xinxiang International Trade Co., Ltd.",5.0
https://usf.en.alibaba.com/company_profile.html#top-nav-bar,"Xiamen Useful Imp & Exp Co., Ltd.",5.0
https://nbhongmeng.en.alibaba.com/company_profile.html#top-nav-bar,"Ningbo Hongmeng Crafts Co., Ltd.,Supplier",4.9
https://dehaoyu.en.alibaba.com/company_profile.html#top-nav-bar,"Dong'e County Hao Yu Trading Co., Ltd.,Supplier",
https://njbewe.en.alibaba.com/company_profile.html#top-nav-bar,"Nanjing Bewe Intl Trading Co., Ltd.,Supplier",4.9
https://haoyuhb.en.alibaba.com/company_profile.html#top-nav-bar,"Cangzhou Haoyu International Trading Co., Ltd.",2.0
https://borson.en.alibaba.com/company_profile.html#top-nav-bar,"Ningbo Borson Import & Export Co., Ltd.",4.9
https://hollot.en.alibaba.com/company_profile.html#top-nav-bar,,
https://gogoautomatic.en.alibaba.com/company_profile.html#top-nav-bar,Ningbo Fenghua Gogo Automatic Trading Company Limited,4.5
https://blsfluid.en.alibaba.com/company_profile.html#top-nav-bar,"Zhejiang L And B Fluid Equipment Co., Ltd.,Supplier",5.0
https://frap.en.alibaba.com/company_profile.html#top-nav-bar,"Zhejiang Furuipu Building Material Import And Export Co,.ltd.",5.0
https://sylue.en.alibaba.com/company_profile.html#top-nav-bar,"Ningbo Sylue Machine Co., Ltd.",4.7
https://wgjx.en.alibaba.com/company_profile.html#top-nav-bar,"Lishui Wangong Precision Machinery Co., Ltd.,Supplier",5.0
https://xiaohai.en.alibaba.com/company_profile.html#top-nav-bar,"Wenzhou Xiaohai I/E Co., Ltd.,Supplier",5.0
https://dewochina.en.alibaba.com/company_profile.html#top-nav-bar,"Changzhou Dewo Motor Co., Ltd.,Supplier",5.0
https://tjxjzc.en.alibaba.com/company_profile.html#top-nav-bar,"Tianjin Xurui Hengda International Trading Co., Ltd.",
https://xuernuo.en.alibaba.com/company_profile.html#top-nav-bar,"Xuernuo Industrial (Dongguan)Co., Limited",
https://lsyunchuang.en.alibaba.com/company_profile.html#top-nav-bar,"Lishui Yunchuang Machinery Equipment Co., Ltd.",5.0
https://lsyongrun.en.alibaba.com/company_profile.html#top-nav-bar,"Lishui City Yong Run Precision Machinery Co., Ltd.",5.0
https://tnkbearing.en.alibaba.com/company_profile.html#top-nav-bar,"Jinhua Fuchang Machinery Equipment Co., Ltd.",5.0
https://cnydbearing.en.alibaba.com/company_profile.html#top-nav-bar,"Zaozhuang Yiding Bearing Co., Ltd.",5.0
https://sdjrcd.en.alibaba.com/company_profile.html#top-nav-bar,"Shandong Jingrui Transmission Technology Co., Ltd.",
https://ersk.en.alibaba.com/company_profile.html#top-nav-bar,"Lishui Wangong Precision Machinery Co., Ltd.",5.0
https://jntongxin.en.alibaba.com/company_profile.html#top-nav-bar,,
https://terry-machinery.en.alibaba.com/company_profile.html#top-nav-bar,"Changsha Terry Machinery Co., Ltd.",4.9
https://semribearing.en.alibaba.com/company_profile.html#top-nav-bar,"Tianjin Semri Bearing Technology Co., Ltd.",4.9
https://kelunte.en.alibaba.com/company_profile.html#top-nav-bar,"Jinan Kelunte Bearing Co., Ltd.",4.9
https://rhd.en.alibaba.com/company_profile.html#top-nav-bar,"Jinan Ruihode Bearing Co., Ltd.",5.0
https://screwjack.en.alibaba.com/company_profile.html#top-nav-bar,"Dongguan Nosen M&E Technology Co., Ltd.",
https://dzlude.en.alibaba.com/company_profile.html#top-nav-bar,"Dezhou Lude Transmission Equipments Co., Ltd.",5.0
https://sdguomao.en.alibaba.com/company_profile.html#top-nav-bar,"Shandong Guomaoguotai Reducer Co., Ltd.",5.0
https://cnreducer.en.alibaba.com/company_profile.html#top-nav-bar,"Shandong Vinson Machinery Co., Ltd.",5.0
https://jactonindustry.en.alibaba.com/company_profile.html#top-nav-bar,"Dongguan Jacton Industry Co., Ltd.",4.9
