supplier_url,supplier_name,rating
https://cns-welcome.en.alibaba.com/company_profile.html#top-nav-bar,"Changzhou S-Welcome Metal Product Co., Ltd.",4.7
https://kylinfitness.en.alibaba.com/company_profile.html#top-nav-bar,"Nantong Kylin Sporting Equipment Co., Ltd.",4.5
https://ntrisingsport.en.alibaba.com/company_profile.html#top-nav-bar,"Nantong Rising Sporting Goods Co., Ltd.",
https://iusummer.en.alibaba.com/company_profile.html#top-nav-bar,"Wuxi IUSummer Tech Co., Ltd.",4.7
https://sunskifitness.en.alibaba.com/company_profile.html#top-nav-bar,"Anhui Sunski Fitness Co., Ltd.",5.0
https://fitnesssport.en.alibaba.com/company_profile.html#top-nav-bar,"Rizhao Fitness Sport Co., Ltd.",4.9
https://aiflexfitness.en.alibaba.com/company_profile.html#top-nav-bar,"Suzhou Aiflex International Trade Co., Ltd.",5.0
https://jxjsb.en.alibaba.com/company_profile.html#top-nav-bar,"Jiangxi Jinshibao Mining Machinery Manufacturing Co., Ltd.",1.3
https://iraeta.en.alibaba.com/company_profile.html#top-nav-bar,"Iraeta Energy Equipment Co., Ltd.",
https://luhengmachinery.en.alibaba.com/company_profile.html#top-nav-bar,"Jining Luheng Machinery Equipment Co., Ltd.,Supplier",4.8
https://qztaihong.en.alibaba.com/company_profile.html#top-nav-bar,"Qingzhou Taihong Special Casting Steel Co., Ltd.",
https://goldenforging.en.alibaba.com/company_profile.html#top-nav-bar,"Jiangyin Golden Machinery Equipment Co., Ltd.",
https://tbt-scietech.en.alibaba.com/company_profile.html#top-nav-bar,"Nanjing T-Bota Scietech Instruments & Equipment Co., Ltd.",4.1
https://paiputech.en.alibaba.com/company_profile.html#top-nav-bar,,
https://deco-mill.en.alibaba.com/company_profile.html#top-nav-bar,"Changsha Deco Equipment Co., Ltd.",0.0
https://ebcasting.en.alibaba.com/company_profile.html#top-nav-bar,"Wuxi Eternal Bliss Alloy Casting & Forging Co., Ltd.",4.7
https://concentrationtable.en.alibaba.com/company_profile.html#top-nav-bar,"Jiangxi Province County Mining Machinery Factory,Supplier",5.0
https://zqyubin.en.alibaba.com/company_profile.html#top-nav-bar,Zhangqiu Yu Bin Petrochemical Fittings Factory,5.0
https://jnxinte.en.alibaba.com/company_profile.html#top-nav-bar,"Jinan Xinte Casting And Forging Co., Ltd.",
https://cncastingball.en.alibaba.com/company_profile.html#top-nav-bar,"Ningguo Nanfang Wear-Resistant Materials Co., Ltd.",
https://deyamachinery.en.alibaba.com/company_profile.html#top-nav-bar,Henan Deya Machinery Company Limited,5.0
https://huamin.en.alibaba.com/company_profile.html#top-nav-bar,"Shandong Huamin Steel Ball Joint-Stock Co., Ltd.",
https://donxe.en.alibaba.com/company_profile.html#top-nav-bar,"Shanghai Donxe Industrial Co., Ltd.",4.8
https://newestmachinery.en.alibaba.com/company_profile.html#top-nav-bar,"Jiaozuo Newest Machinery Co., Ltd.",4.3
https://ytdali.en.alibaba.com/company_profile.html#top-nav-bar,"Qixia Dali Mine Machinery Co., Ltd.,Supplier",5.0
https://hnubt.en.alibaba.com/company_profile.html#top-nav-bar,"Hunan Ubetter Nano Technology Co., Ltd.",5.0
https://jingweiss14.en.alibaba.com/company_profile.html#top-nav-bar,"Jiangsu Jingwei Conveying Equipment Co., Ltd.",4.3
https://tiexinjixie.en.alibaba.com/company_profile.html#top-nav-bar,"Shijiazhuang Huanpai Machine Co., Ltd.",
https://ytxh.en.alibaba.com/company_profile.html#top-nav-bar,Shandong Xinhai Mining Technology & Equipment Inc.,5.0
https://gelinmachinery.en.alibaba.com/company_profile.html#top-nav-bar,Ganzhou Gelin Mining Machinery Company Limited,5.0
https://newestmachine.en.alibaba.com/company_profile.html#top-nav-bar,"Jiaozuo Newest Machinery Co., Ltd.",5.0
https://zenith.en.alibaba.com/company_profile.html#top-nav-bar,,
https://zenithcrusher.en.alibaba.com/company_profile.html#top-nav-bar,"Shanghai Zenith Minerals Co., Ltd.",0.0
https://zenithmining.en.alibaba.com/company_profile.html#top-nav-bar,"Shanghai Zenith Minerals Co., Ltd.",0.0
https://chinasbm.en.alibaba.com/company_profile.html#top-nav-bar,"Shibang Industry & Technology Group Co., Ltd.",0.0
https://sbmchina.en.alibaba.com/company_profile.html#top-nav-bar,"Shibang Industry & Technology Group Co., Ltd.",0.0
https://shsb.en.alibaba.com/company_profile.html#top-nav-bar,"Shibang Industry & Technology Group Co., Ltd.",0.0
https://quarryingtools.en.alibaba.com/company_profile.html#top-nav-bar,"Xiamen Bestlink Factory Co., Ltd.,Supplier",5.0
https://oremagnetic.en.alibaba.com/company_profile.html#top-nav-bar,"Xi'an Desen Mining Machinery Equipment Co., Ltd.",4.9
https://hcksjx.en.alibaba.com/company_profile.html#top-nav-bar,"Jiangxi Hengchang Mining Machinery Manufacturing Co., Ltd.",5.0
https://wymy.en.alibaba.com/company_profile.html#top-nav-bar,"Zhejiang Ma-Yang Industries Co., Ltd.,Supplier",
https://chaozhongchina.en.alibaba.com/company_profile.html#top-nav-bar,"Chaoyang Heavy Machinery Manufacturing Co., Ltd.",5.0
https://machinexy.en.alibaba.com/company_profile.html#top-nav-bar,"Henan Xingyang Mining Machinery Manufactory,Supplier",
https://lyyjindustry.en.alibaba.com/company_profile.html#top-nav-bar,"Luoyang Yujie Industry & Trade Co., Ltd.,Supplier",5.0
https://labequipments.en.alibaba.com/company_profile.html#top-nav-bar,"Jiangxi Walker Machinery Co., Ltd.,Supplier",0.0
https://qmmining.en.alibaba.com/company_profile.html#top-nav-bar,"Wuyi Qiangmei Mining Machinery Co., Ltd.",
https://hjmachine.en.alibaba.com/company_profile.html#top-nav-bar,"Henan Hongji Mine Machinery Co., Ltd.,Supplier",
https://yaxinark.en.alibaba.com/company_profile.html#top-nav-bar,,
https://debontech.en.alibaba.com/company_profile.html#top-nav-bar,"Jiaozuo Debon Technology Co., Ltd.,Supplier",
https://shechomachinery.en.alibaba.com/company_profile.html#top-nav-bar,"Shanghai Echo Machinery Co., Ltd.,Supplier",5.0
https://hcmining.en.alibaba.com/company_profile.html#top-nav-bar,"Gongyi Hengchang Metallurgical Building Material Equipments Plant,Supplier",
https://zztyjq.en.alibaba.com/company_profile.html#top-nav-bar,"Zhengzhou General Mining Machinery Co., Ltd.",
https://lywlzj.en.alibaba.com/company_profile.html#top-nav-bar,"Luoyang Wangli Heavy Machinery Co., Ltd.,Supplier",5.0
https://citicic.en.alibaba.com/company_profile.html#top-nav-bar,"Luoyang Zhongtai Industries Co., Ltd.",
https://miningmachine.en.alibaba.com/company_profile.html#top-nav-bar,"Qingzhou Keda Environment Protection Machinery Co.,Ltd.,Supplier",0.0
https://sdguote.en.alibaba.com/company_profile.html#top-nav-bar,"Weifang Guote Mining Equipment Co., Ltd.",5.0
https://wfzhengyuan.en.alibaba.com/company_profile.html#top-nav-bar,,
https://hnylk.en.alibaba.com/company_profile.html#top-nav-bar,"Changsha Yonglekang Equipment Co., Ltd.",4.7
https://sunstrike-machine.en.alibaba.com/company_profile.html#top-nav-bar,"Henan Sunstrike Machinery & Equipment Co., Ltd.",5.0
https://bhtech.en.alibaba.com/company_profile.html#top-nav-bar,"BH Mortar Industrial Co., Ltd.",5.0
https://ameenergy.en.alibaba.com/company_profile.html#top-nav-bar,"Shandong AME Energy Co., Ltd.",5.0
https://hnhxjq.en.alibaba.com/company_profile.html#top-nav-bar,"Henan Hongxing Mining Machinery Co., Ltd.",
https://lydh.en.alibaba.com/company_profile.html#top-nav-bar,"Luoyang Dahua Heavy Type Machinery Co., Ltd.",
https://zzzb.en.alibaba.com/company_profile.html#top-nav-bar,"Zhengzhou Hongji Mining Machinery Co., Ltd.",5.0
https://ytfulin.en.alibaba.com/company_profile.html#top-nav-bar,,
https://break-day.en.alibaba.com/company_profile.html#top-nav-bar,"Henan Liming Heavy Industry Science & Technology Co., Ltd.",0.0
https://atairac.en.alibaba.com/company_profile.html#top-nav-bar,Atairac Engineered Products Inc (China),
https://dingbocrusher.en.alibaba.com/company_profile.html#top-nav-bar,"Shanghai Dingbo Heavy Industry Machinery Co., Ltd.",0.0
https://zenithdream.en.alibaba.com/company_profile.html#top-nav-bar,"Shanghai Zenith Minerals Co., Ltd.",0.0
https://todaymachine.en.alibaba.com/company_profile.html#top-nav-bar,"Today Machine Co., Ltd. (Shenzhen)",4.3
https://stoneplus.en.alibaba.com/company_profile.html#top-nav-bar,"Xiamen Stoneplus Machinery Co., Ltd.",5.0
https://zzbailing.en.alibaba.com/company_profile.html#top-nav-bar,"Henan Bailing Machinery Co., Ltd.",5.0
https://tmax.en.alibaba.com/company_profile.html#top-nav-bar,"Xiamen Tmax Battery Equipments Limited,Supplier",4.9
https://mitr.en.alibaba.com/company_profile.html#top-nav-bar,"Changsha Mitrcn Instrument Equipment Co., Ltd.",5.0
https://hnhongji.en.alibaba.com/company_profile.html#top-nav-bar,"Henan Hongji Mine Machinery Co., Ltd.,Supplier",5.0
https://vostosun.en.alibaba.com/company_profile.html#top-nav-bar,"Shanghai Vostosun Industrial Co., Ltd.,Supplier",
https://epicpowder.en.alibaba.com/company_profile.html#top-nav-bar,"Qingdao Epic Powder Machinery Co., Ltd.",5.0
https://lyhongxin.en.alibaba.com/company_profile.html#top-nav-bar,"Luoyang Hongxin Heavy Machinery Co., Ltd.,Supplier",
https://deruijx.en.alibaba.com/company_profile.html#top-nav-bar,"Gongyi Derui Machinery Co., Ltd.",
https://hnyxzg.en.alibaba.com/company_profile.html#top-nav-bar,,
https://jcxk.en.alibaba.com/company_profile.html#top-nav-bar,"Shicheng Jinchuan Mineral Equipment Co., Ltd.",4.3
https://xinhaimining.en.alibaba.com/company_profile.html#top-nav-bar,Shandong Xinhai Mining Technology & Equipment Inc.,0.0
https://zzjintai.en.alibaba.com/company_profile.html#top-nav-bar,"Zhengzhou Jinhe Machinery Manufacture Co., Ltd.",4.8
https://instruments.en.alibaba.com/company_profile.html#top-nav-bar,"Zhengzhou CY Scientific Instrument Co., Ltd.,Supplier",4.8
https://baichy.en.alibaba.com/company_profile.html#top-nav-bar,"Henan Baichy Machinery Equipment Co., Ltd.",
https://gxzw.en.alibaba.com/company_profile.html#top-nav-bar,"Shicheng Gaoxuan Bearing Bush Co., Ltd.",
https://scwanshuntong.en.alibaba.com/company_profile.html#top-nav-bar,"Shicheng Wanshun Tong Mining Equipment Co., Ltd.",
https://hongjigroup.en.alibaba.com/company_profile.html#top-nav-bar,"Henan Hongji Mine Machinery Co., Ltd.,Supplier",5.0
https://kefidchina.en.alibaba.com/company_profile.html#top-nav-bar,"Zhengzhou Kefid Mechanical Industry Science & Technology Co., Ltd.",0.0
https://greenfrom.en.alibaba.com/company_profile.html#top-nav-bar,"Jiangmen Greenfrom Household Co., Ltd.,Supplier",5.0
https://powerme88.en.alibaba.com/company_profile.html#top-nav-bar,"Shenzhen Powerme Plastic Manufacturing Co., Ltd.,Supplier",4.5
https://touchbeauty.en.alibaba.com/company_profile.html#top-nav-bar,"Shenzhen TOUCHBeauty Ind. & Exp. Co., Ltd.",
https://lightiger.en.alibaba.com/company_profile.html#top-nav-bar,"Shenzhen Lightiger Industries Co., Ltd.",4.4
https://yixin-china.en.alibaba.com/company_profile.html#top-nav-bar,"Jinan Laiwu Yixin Arts And Crafts Co., Ltd.",
https://geeliansafety.en.alibaba.com/company_profile.html#top-nav-bar,"Chengdu Geelian Safety Co., Ltd.",5.0
https://bx-group.en.alibaba.com/company_profile.html#top-nav-bar,"Baixiang Houseware Co., Ltd. (Jiangmen)",5.0
https://nbbolder.en.alibaba.com/company_profile.html#top-nav-bar,,
https://skysword.en.alibaba.com/company_profile.html#top-nav-bar,"Shenzhen Ruichaoteng Technology Co., Ltd.",4.8
https://nbsuperclean.en.alibaba.com/company_profile.html#top-nav-bar,"Ningbo Super Clean Co., Limited",
https://shhindustries.trustpass.alibaba.com/company_profile.html#top-nav-bar,SHH INDUSTRIES,
https://pk1003218610007.trustpass.alibaba.com/company_profile.html#top-nav-bar,ASHWAY INTERNATIONAL,
https://cnfengyuan.en.alibaba.com/company_profile.html#top-nav-bar,"Shenzhen Fengyuan Overseas Trading Co., Ltd.",4.8
https://pk1334184113axfo.trustpass.alibaba.com/company_profile.html#top-nav-bar,NAWAB BROTHERS,
https://cnphenix.en.alibaba.com/company_profile.html#top-nav-bar,"Ningbo Phenix Commercial Co., Ltd.",5.0
https://pk1046695716.trustpass.alibaba.com/company_profile.html#top-nav-bar,POWER PUNCH,
https://pk1336191659mhrk.trustpass.alibaba.com/company_profile.html#top-nav-bar,NAQSH-E-LASANI TRADE,
https://hzdingxin.en.alibaba.com/company_profile.html#top-nav-bar,"Huizhou Dingshuai Silicone Products Co., Ltd.,Supplier",4.9
https://supercandle.en.alibaba.com/company_profile.html#top-nav-bar,"Hebei Supercandle Trading Co., Ltd.,Supplier",4.5
https://jn-machinery.en.alibaba.com/company_profile.html#top-nav-bar,"Taizhou Huangyan Juneng Machine And Mould Co., Ltd.",
https://chinaruicheng.en.alibaba.com/company_profile.html#top-nav-bar,"Xiamen RuiCheng Industrial Design Co., Ltd.",5.0
https://mekatech.en.alibaba.com/company_profile.html#top-nav-bar,"Huizhou Meka Technology Co., Ltd.",4.8
https://szulite.en.alibaba.com/company_profile.html#top-nav-bar,Shenzhen Ulite Precision Tech Limited,0.0
https://gxxzc.en.alibaba.com/company_profile.html#top-nav-bar,"Guangxi Nanning Xinzhichao Trade Co., Ltd.",4.7
https://china-eps.en.alibaba.com/company_profile.html#top-nav-bar,"Eps Industry Engineering Co., Ltd.",4.5
https://chinaxinghuo.en.alibaba.com/company_profile.html#top-nav-bar,Ruian Xinghuo Mould Factory,5.0
https://wgmachine.en.alibaba.com/company_profile.html#top-nav-bar,"Nanjing Wanguo Machinery Technology Co., Ltd.",4.7
https://xbhx.en.alibaba.com/company_profile.html#top-nav-bar,"Chongqing Xingbang Hengxiang Mold Co., Ltd.",5.0
https://reallygoodplastic.en.alibaba.com/company_profile.html#top-nav-bar,"Dongguan Yiot Technology Co., Ltd.,Supplier",4.9
https://candymould.en.alibaba.com/company_profile.html#top-nav-bar,"Ningbo Lufeng Mould Mechanical Co., Ltd.",4.8
https://tddindustrial.en.alibaba.com/company_profile.html#top-nav-bar,"Huizhou City Tianduoduo Industry Co., Ltd.",5.0
https://waag.en.alibaba.com/company_profile.html#top-nav-bar,"Guangzhou Easttop Imp. & Exp. Co., Ltd.",3.6
https://ykxm2012.en.alibaba.com/company_profile.html#top-nav-bar,"Yongkang Xingmao Import & Export Co., Ltd.,Supplier",4.9
https://jiulongind.en.alibaba.com/company_profile.html#top-nav-bar,"Ningbo Jiulong International Co., Ltd.,Supplier",5.0
https://4x4offroad.en.alibaba.com/company_profile.html#top-nav-bar,"Guangzhou 4x4 Offroad Running Auto Accessories Co., Ltd.",5.0
https://redfoxcn.en.alibaba.com/company_profile.html#top-nav-bar,"Jinan Redfox Hardware Co., Ltd.",5.0
https://dl4wd.en.alibaba.com/company_profile.html#top-nav-bar,"Guangzhou Deliang Auto Accessory Co., Ltd.",5.0
https://qdthinkwell.en.alibaba.com/company_profile.html#top-nav-bar,"Qingdao Thinkwell Hardware And Machinery Co., Ltd.",5.0
https://qdkemei.en.alibaba.com/company_profile.html#top-nav-bar,"Qingdao Kemei Trailer Manufacturing Co., Ltd.",
https://jyjxc.en.alibaba.com/company_profile.html#top-nav-bar,"Jinan Duobaoli Machinery Co., Ltd.",
https://crg4wd.en.alibaba.com/company_profile.html#top-nav-bar,,
https://anmaindustry.en.alibaba.com/company_profile.html#top-nav-bar,"Shanghai Anma Industry Co., Ltd.",5.0
https://cargocontrol.en.alibaba.com/company_profile.html#top-nav-bar,"Qingdao Ever Bright Import and Export Co., Ltd.,Supplier",5.0
https://ititowking.en.alibaba.com/company_profile.html#top-nav-bar,"Intradin (Shanghai) Hardware Co., Ltd.",
https://jdbtech.en.alibaba.com/company_profile.html#top-nav-bar,"Shenzhen JDB Technology Co., Ltd.",5.0
https://aubadi.en.alibaba.com/company_profile.html#top-nav-bar,"Shenzhen Aubadi Plastic Electronics Co., Ltd.",4.0
https://skying.en.alibaba.com/company_profile.html#top-nav-bar,"Shenzhen Skying Electronics Co., Ltd.",5.0
https://qusart.en.alibaba.com/company_profile.html#top-nav-bar,"Shenzhen Qusart Technology Co., Ltd.",4.4
https://umemory.en.alibaba.com/company_profile.html#top-nav-bar,"Shenzhen Umemory Digital Technology Co., Ltd.",5.0
https://frs-teh.en.alibaba.com/company_profile.html#top-nav-bar,"Shenzhen Free & Easy Technology Co., Ltd.",0.0
https://kintop.en.alibaba.com/company_profile.html#top-nav-bar,"Dongguan Kintop Electronic Co., Ltd.",
https://digitalfactory.en.alibaba.com/company_profile.html#top-nav-bar,"Shenzhen Micropower Technology Development Co., Ltd.",0.0
https://zandy.en.alibaba.com/company_profile.html#top-nav-bar,"Yiwu City Zandy Import & Export Co., Limited",4.6
https://drchina.en.alibaba.com/company_profile.html#top-nav-bar,"Dongyang Derun Glitter Material Co., Ltd.",4.8
https://penglv.en.alibaba.com/company_profile.html#top-nav-bar,"Yiwu Penglv Jewelry Co., Ltd.",4.3
https://brosar.en.alibaba.com/company_profile.html#top-nav-bar,"Yiwu Brillant Trading Co., Ltd.",4.4
https://yichangdg.en.alibaba.com/company_profile.html#top-nav-bar,Dongguan Dalingshan Yichang Hardware Shop,4.6
https://hihjewelry.en.alibaba.com/company_profile.html#top-nav-bar,"Shenzhen Hih Jewelry Co., Ltd.,Supplier",4.8
https://ywfinewell.en.alibaba.com/company_profile.html#top-nav-bar,Yiwu Finewell Jewelry Firm,4.7
https://jinye.en.alibaba.com/company_profile.html#top-nav-bar,"Guangzhou Sundysh E&F Accessories Co., Ltd.",4.7
https://charmjewelry.en.alibaba.com/company_profile.html#top-nav-bar,"Guangzhou Charming Times Jewelry Co., Ltd.",4.9
https://qdshijie.en.alibaba.com/company_profile.html#top-nav-bar,"Qingdao Shijie Fashion Accessories Co., Ltd.,Supplier",4.8
https://mkhinc.en.alibaba.com/company_profile.html#top-nav-bar,"Suzhou Mkh Import & Export Co., Ltd.",4.9
https://famoustechnology.en.alibaba.com/company_profile.html#top-nav-bar,"Shenzhen Famous Technology Co., Ltd.",4.9
https://zily.en.alibaba.com/company_profile.html#top-nav-bar,"Yongkang Zily Industry & Trade Co., Ltd.",5.0
https://rayee.en.alibaba.com/company_profile.html#top-nav-bar,Rayee International Corporation Limited,4.8
https://hbaining.en.alibaba.com/company_profile.html#top-nav-bar,"Hebei Aining Import And Export Trading Co., Ltd.",5.0
https://sdjinguan.en.alibaba.com/company_profile.html#top-nav-bar,"Shandong Jinguan Net Co., Ltd.,Supplier",5.0
https://gstoy.en.alibaba.com/company_profile.html#top-nav-bar,"Jiangmen Guangshan Plastics Product Co., Ltd.",4.9
https://bizgreat.en.alibaba.com/company_profile.html#top-nav-bar,,
https://gznianfa.en.alibaba.com/company_profile.html#top-nav-bar,Guangzhou Nian Fa Wire Mesh Factory,4.6
https://de-ju.en.alibaba.com/company_profile.html#top-nav-bar,"Shengzhou De-Ju Import & Export Co., Ltd.",4.5
https://goldensky.en.alibaba.com/company_profile.html#top-nav-bar,"Shenzhen Golden Sky Sports Co., Ltd.",5.0
https://kcwiremesh.en.alibaba.com/company_profile.html#top-nav-bar,"Anping Kangchen Wire Mesh Products Co., Ltd.",
https://unityplastic.en.alibaba.com/company_profile.html#top-nav-bar,"Zhengzhou Unity Plastic Co., Ltd.",4.9
https://nationalsports.trustpass.alibaba.com/company_profile.html#top-nav-bar,NATIONAL SPORTS,
https://zhanshentiyu.en.alibaba.com/company_profile.html#top-nav-bar,"Shandong Zhanshen Sports Products Co., Ltd.",
https://bjydt.en.alibaba.com/company_profile.html#top-nav-bar,"Baoji Enda Metal Co., Ltd.",4.7
https://cmjs-cn.en.alibaba.com/company_profile.html#top-nav-bar,"Suzhou Chuanmao Metal Material Co., Ltd.",5.0
https://soonv.en.alibaba.com/company_profile.html#top-nav-bar,"Shanghai Soonv Special Alloy Co., Ltd.",
https://dowellmagnet.en.alibaba.com/company_profile.html#top-nav-bar,"Hangzhou Dowell Magnet Co., Limited",0.0
https://xaxinheng.en.alibaba.com/company_profile.html#top-nav-bar,,
https://hnallianz.en.alibaba.com/company_profile.html#top-nav-bar,"Hunan Allianz Metal Products Co., Ltd.",0.0
https://zj-jne.en.alibaba.com/company_profile.html#top-nav-bar,"Zhejiang Jienaier New Material Co., Ltd.",
https://ronsteel.en.alibaba.com/company_profile.html#top-nav-bar,"Hunan Allianz Metal Products Co., Ltd.",0.0
https://czhayu.en.alibaba.com/company_profile.html#top-nav-bar,"Changzhou Hayu Tooling Co., Ltd.",0.0
https://jzyzhj.en.alibaba.com/company_profile.html#top-nav-bar,"Zhuzhou HAO Carbide Co., Ltd.",4.9
https://endmill.en.alibaba.com/company_profile.html#top-nav-bar,"Changzhou North Carbide Tool Co., Ltd.,Supplier",5.0
https://dhcutter.en.alibaba.com/company_profile.html#top-nav-bar,"Shenzhen Dehuai Technology Co., Ltd.",4.8
https://centerendmill.en.alibaba.com/company_profile.html#top-nav-bar,"Changzhou Center Tools Co., Ltd.",4.9
https://szjrwg.en.alibaba.com/company_profile.html#top-nav-bar,"Shenzhen Jinrui Precision Carbide Technology Co., Ltd.",
https://zzbt.en.alibaba.com/company_profile.html#top-nav-bar,"Zhuzhou Better Tungsten Carbide Co., Limited,Supplier",4.9
https://tongyutools.en.alibaba.com/company_profile.html#top-nav-bar,"Danyang Tongyu Tools Co., Ltd.",5.0
https://zzyftools.en.alibaba.com/company_profile.html#top-nav-bar,,
https://zzapple.en.alibaba.com/company_profile.html#top-nav-bar,"Zhuzhou Apple Carbide Tools Co., Ltd.",5.0
https://dglisuo.en.alibaba.com/company_profile.html#top-nav-bar,Dongguan Lishuo Hardware Mould Components Business Department,4.8
https://jswx.en.alibaba.com/company_profile.html#top-nav-bar,"Jiangsu Weixiang Tool Manufacturing Co., Ltd.",5.0
https://hzdtsk.en.alibaba.com/company_profile.html#top-nav-bar,"Hangzhou Datian CNC Machine Tool Co., Ltd.",5.0
https://hzoic.en.alibaba.com/company_profile.html#top-nav-bar,"Hangzhou Ocean Industry Co., Ltd.,Supplier",5.0
https://cnhzoic.en.alibaba.com/company_profile.html#top-nav-bar,"Hangzhou Ocean Industry Co., Ltd.",5.0
https://jiyan.en.alibaba.com/company_profile.html#top-nav-bar,"Huizhou City Jiyan Precision Metal Parts Factory,Supplier",4.9
https://tandyfastener.en.alibaba.com/company_profile.html#top-nav-bar,"Shanghai T & Y Hardware Industry Co., Ltd.",5.0
https://msr.en.alibaba.com/company_profile.html#top-nav-bar,"Shaoxing Shangyu Mesier Metal Products Co., Ltd.",5.0
https://demark.en.alibaba.com/company_profile.html#top-nav-bar,"DEMARK (Beijing) Commercial Trading Co., Ltd.",4.8
https://chinadfh.en.alibaba.com/company_profile.html#top-nav-bar,"Ningbo Defa Technology Co., Ltd.,Supplier",5.0
https://axbearing.en.alibaba.com/company_profile.html#top-nav-bar,"Hebei Aoxiang Bearing Manufacturing Co., Ltd.",
https://keeppower-ic.en.alibaba.com/company_profile.html#top-nav-bar,"Keep Power Electronic Co.,Ltd",5.0
https://motion-bearing.en.alibaba.com/company_profile.html#top-nav-bar,"Motion (Shanghai) Industrial Development Co., Ltd.",5.0
https://swcpu.en.alibaba.com/company_profile.html#top-nav-bar,,
https://hanzhao.en.alibaba.com/company_profile.html#top-nav-bar,"Hangzhou Hanzhao Technology Co., Ltd.",4.8
https://yiwujilong.en.alibaba.com/company_profile.html#top-nav-bar,"Yiwu Jilong Imp. & Exp. Co., Ltd.",4.6
https://listerxm.en.alibaba.com/company_profile.html#top-nav-bar,"Xiamen Caster Import & Export Co., Ltd.",5.0
https://wxevergreen.en.alibaba.com/company_profile.html#top-nav-bar,Wuxi Evergreen Company Ltd.,4.8
https://zyoceanball.en.alibaba.com/company_profile.html#top-nav-bar,Dongguan Huangjiang Zhiyuan Plastic Factory,
https://allrightad.en.alibaba.com/company_profile.html#top-nav-bar,"Taian Allright Advertisement & Trading Co., Ltd.",4.9
https://szdoublewin.en.alibaba.com/company_profile.html#top-nav-bar,Dongguan Changpin Doublewin Electronics Factory,5.0
https://forgedball.en.alibaba.com/company_profile.html#top-nav-bar,"Shandong Shengye Grinding Ball Co., Ltd.",
https://hybmachinery.en.alibaba.com/company_profile.html#top-nav-bar,"Shenyang Huayue Brilliant Machinery&Equipment Co., Ltd.",1.3
https://yanrefitness.en.alibaba.com/company_profile.html#top-nav-bar,"Shanghai Eastern Yanre Fitness Equipment Co., Ltd.,Supplier",5.0
https://tengfengmachinery.en.alibaba.com/company_profile.html#top-nav-bar,"Guangzhou Teng Feng Machinery Co., Ltd.",5.0
https://jejahk.en.alibaba.com/company_profile.html#top-nav-bar,"Shenzhen JEJA Electronics Co., Ltd.",4.9
https://purpleled.en.alibaba.com/company_profile.html#top-nav-bar,"Shaoxing Shenghui Optoelectronics Technology Co., Ltd.",5.0
https://sresky.en.alibaba.com/company_profile.html#top-nav-bar,"Shenzhen Sresky Co., Ltd.,Supplier",5.0
https://ledora.en.alibaba.com/company_profile.html#top-nav-bar,"Shenzhen Ledora Lighting Co., Ltd.",4.9
https://solaraxy.en.alibaba.com/company_profile.html#top-nav-bar,"Shenzhen Sresky Co., Ltd.",5.0
https://douyang.en.alibaba.com/company_profile.html#top-nav-bar,"Dongguan Douyang Electronic Technology Co., Ltd.",4.8
https://pixel.en.alibaba.com/company_profile.html#top-nav-bar,"Shenzhen SH LED Technology Co., Limited,Supplier",4.7
https://guanyi-light.en.alibaba.com/company_profile.html#top-nav-bar,"Dongguan Guanyi Light-Decoration Co., Ltd.",4.7
https://gadksports.trustpass.alibaba.com/company_profile.html#top-nav-bar,,
https://xyztoys.en.alibaba.com/company_profile.html#top-nav-bar,"Shantou City New Canna Education Toys Co., Ltd.",5.0
https://xinjiayu.en.alibaba.com/company_profile.html#top-nav-bar,"Shenzhen Xinjiayu Plastic Co., Ltd.",4.3
https://dkjl.en.alibaba.com/company_profile.html#top-nav-bar,"DKJL CO., LTD.,Supplier",5.0
https://xupingjewelry.en.alibaba.com/company_profile.html#top-nav-bar,,
https://ywchancy.en.alibaba.com/company_profile.html#top-nav-bar,"Yiwu Chancy Garment Accessories Co., Ltd.",4.9
https://moyujewelry.en.alibaba.com/company_profile.html#top-nav-bar,"Shenzhen Moyu Jewelry Co., Ltd.",4.9
https://eternal-blue.en.alibaba.com/company_profile.html#top-nav-bar,"Shenzhen Eternal-Blue Technology Co., Ltd.",4.5
https://el-lighting.en.alibaba.com/company_profile.html#top-nav-bar,"Guangzhou EL Stage Lighting Co., Limited",4.9
https://marslite.en.alibaba.com/company_profile.html#top-nav-bar,"Guangzhou Mars Lighting Technology Co., Ltd.",4.8
https://wayulight.en.alibaba.com/company_profile.html#top-nav-bar,Guangzhou Wayu Light Equipment Limited,5.0
https://gzleahua.en.alibaba.com/company_profile.html#top-nav-bar,"GZ Leahua Light Co., Limited,Supplier",5.0
https://systage12.en.alibaba.com/company_profile.html#top-nav-bar,"Guangzhou SY Stage Equipment Co., Ltd.",5.0
https://hosen.en.alibaba.com/company_profile.html#top-nav-bar,Guangzhou Hosen Lighting Technology Limited,4.6
https://linhuabusiness.en.alibaba.com/company_profile.html#top-nav-bar,"Guangzhou Linhua Technology Co., Ltd.",5.0
https://eastsunlite.en.alibaba.com/company_profile.html#top-nav-bar,"Guangzhou EastSun Lighting Co., Limited",0.0
https://tanfly.en.alibaba.com/company_profile.html#top-nav-bar,"Foshan Tanfly Furniture Co., Ltd.,Supplier",
