supplier_url,supplier_name,rating
https://lpzm.en.alibaba.com/company_profile.html#top-nav-bar,"Shanghai Lipu Electric Lighting Co., Ltd.",0.0
https://growstar.en.alibaba.com/company_profile.html#top-nav-bar,"Quanzhou Orientrise Horticulture Products Co., Ltd.",4.8
https://sinowell.en.alibaba.com/company_profile.html#top-nav-bar,"Sinowell (Shanghai) Co., Ltd.,Supplier",4.9
https://czxinde.en.alibaba.com/company_profile.html#top-nav-bar,"Changzhou City Wujin Shinder Lighting Appliances Co., Ltd.",4.3
https://hydroponics-products.en.alibaba.com/company_profile.html#top-nav-bar,"Huizhou HongYi Lighting Co., Ltd.",4.9
https://bistar.en.alibaba.com/company_profile.html#top-nav-bar,"Lanxi Bistar Lighting Co., Ltd.",0.0
https://horti-king.en.alibaba.com/company_profile.html#top-nav-bar,,
https://jr-lighting.en.alibaba.com/company_profile.html#top-nav-bar,"Shanghai JingRui Lighting Co., Ltd.",4.9
https://millenium.en.alibaba.com/company_profile.html#top-nav-bar,"Shanghai Millenium Industry Co., Ltd.,Supplier",4.9
https://jayotech.en.alibaba.com/company_profile.html#top-nav-bar,"Shenzhen Jayo Technologies Co., Ltd.",5.0
https://raylux.en.alibaba.com/company_profile.html#top-nav-bar,"Xiaogan Raylux Lighting Co., Ltd.",
https://risenlighting.en.alibaba.com/company_profile.html#top-nav-bar,"Huizhou Risen Lighting Co., Ltd.",4.8
https://sino-well.en.alibaba.com/company_profile.html#top-nav-bar,"Sinowell (Shanghai) Co., Ltd.",5.0
https://new-viewhid.en.alibaba.com/company_profile.html#top-nav-bar,"Guangzhou New View Electrical & Lighting Co., Ltd.",5.0
https://ycgd.en.alibaba.com/company_profile.html#top-nav-bar,"Ningbo Yong Cai Optoelectronic Technology Co., Ltd.",4.8
https://chinuphydro.en.alibaba.com/company_profile.html#top-nav-bar,"Wenzhou Hengxiong Electric Co., Ltd.",4.4
https://gwellgroup.en.alibaba.com/company_profile.html#top-nav-bar,"Gwell Group Co., Ltd.,Supplier",0.0
https://hortlight.en.alibaba.com/company_profile.html#top-nav-bar,"Xuzhou Hortlight Co., Ltd.",5.0
https://hzhortiking.en.alibaba.com/company_profile.html#top-nav-bar,"Chi Na Tech (HZ) Co., Ltd.",4.5
https://virex.en.alibaba.com/company_profile.html#top-nav-bar,"Huizhou Virex Technology Co., Ltd.",4.4
https://kinggrow.en.alibaba.com/company_profile.html#top-nav-bar,"Yongkang Sun-Vehicle Industry & Trade Co., Ltd.",3.3
https://tri-lite.en.alibaba.com/company_profile.html#top-nav-bar,"Hangzhou Triumph Imp & Exp Co., Ltd.",5.0
https://ebm-lighting.en.alibaba.com/company_profile.html#top-nav-bar,Guangzhou EBM Lighting Limited,4.8
https://okayhydro.en.alibaba.com/company_profile.html#top-nav-bar,"Huizhou Jinhong Electric Appliance Co., Ltd.",5.0
https://gzdao.en.alibaba.com/company_profile.html#top-nav-bar,"Guangzhou Deao Light Technology Co., Ltd.",5.0
https://evitekhid.en.alibaba.com/company_profile.html#top-nav-bar,"Guangzhou Evitek Electronic Co., Ltd.",4.8
https://longlifecar.en.alibaba.com/company_profile.html#top-nav-bar,"Guangzhou Longlife Auto Parts Co., Ltd.",5.0
https://gzonelight.en.alibaba.com/company_profile.html#top-nav-bar,"Guangzhou Onelight Car Accessories Co., Ltd.",5.0
https://xuzunhk.en.alibaba.com/company_profile.html#top-nav-bar,"Guangzhou Xuzun Trade  Co., Ltd.",4.8
https://padalight.en.alibaba.com/company_profile.html#top-nav-bar,"Guangzhou P And D Electronic Technology Co., Ltd.",4.4
https://gpusi.en.alibaba.com/company_profile.html#top-nav-bar,Guangzhou Gpusi Electronics Science & Technology Limited,5.0
https://gt-light.en.alibaba.com/company_profile.html#top-nav-bar,"Jiaxing Guangtai Lighting Co., Ltd.,Supplier",5.0
https://honnex.en.alibaba.com/company_profile.html#top-nav-bar,"Wenzhou Honnex Trading Co., Ltd.",5.0
https://tepro.en.alibaba.com/company_profile.html#top-nav-bar,"Foshan Tengnuo Technology Co., Ltd.",5.0
https://milleniumhorticulture.en.alibaba.com/company_profile.html#top-nav-bar,"Shanghai Millenium Industry Co., Ltd.,Supplier",
https://novotek.en.alibaba.com/company_profile.html#top-nav-bar,"Foshan Novotek Optoelectronics Co., Ltd.",4.8
https://wxblpzm.en.alibaba.com/company_profile.html#top-nav-bar,"Wuxi Bolaipu Lighting Technology Co., Ltd.",
https://deplux.en.alibaba.com/company_profile.html#top-nav-bar,"Shaoxing Deplux Lighting Co., Ltd.",5.0
https://fsmyu.en.alibaba.com/company_profile.html#top-nav-bar,"Foshan Ming Yu Electric Light Source Co., Ltd.",3.9
https://tonhilighting.en.alibaba.com/company_profile.html#top-nav-bar,"Suzhou Tonhi Lighting Electric Appliance Co., Ltd.",
https://fitbright.en.alibaba.com/company_profile.html#top-nav-bar,"Hefei Fitbright Energy Saving Technology Co., Ltd.",5.0
https://dglighting.en.alibaba.com/company_profile.html#top-nav-bar,"Liteharbor Lighting Technology Co., Ltd.,Supplier",5.0
https://brandon.en.alibaba.com/company_profile.html#top-nav-bar,"Jiangmen Brandon Lighting Co., Ltd.,Supplier",
https://halcon.en.alibaba.com/company_profile.html#top-nav-bar,"Zhongshan Halcon Lighting & Electrical Co., Ltd.,Supplier",4.9
https://tiaoshun.en.alibaba.com/company_profile.html#top-nav-bar,"Zhongshan TiaoShun Lighting Co., Ltd.",5.0
https://fullwintech.en.alibaba.com/company_profile.html#top-nav-bar,"Shenzhen Fullwin New Tech Co., Ltd.",
https://bayangzm.en.alibaba.com/company_profile.html#top-nav-bar,"Shengzhou Lighting Product Co., Ltd.",
https://zschanglong.en.alibaba.com/company_profile.html#top-nav-bar,"Zhongshan City Changlong Electrical Co., Ltd.",5.0
https://bdtrading.en.alibaba.com/company_profile.html#top-nav-bar,"Guangzhou Trulene Import And Export Co., Ltd.",5.0
https://hualinglighting.en.alibaba.com/company_profile.html#top-nav-bar,Zhongshan Hualing Lighting Inc.,
https://meiyunlighting.en.alibaba.com/company_profile.html#top-nav-bar,"Zhongshan Meiyun Lighting Co., Ltd.,Supplier",5.0
https://delixi-elc.en.alibaba.com/company_profile.html#top-nav-bar,"Hangzhou Delixi Group Co., Ltd.",4.9
https://light-acclaim.en.alibaba.com/company_profile.html#top-nav-bar,"Shanghai Acclaim Industries Co., Ltd.",0.0
https://lightbest.en.alibaba.com/company_profile.html#top-nav-bar,"Changzhou Lightbest Tech. Co., Ltd.",5.0
https://lonyung.en.alibaba.com/company_profile.html#top-nav-bar,"Guangdong Lonyung LED Lighting Co., Ltd.,Supplier",4.9
https://welthink.en.alibaba.com/company_profile.html#top-nav-bar,"Hangzhou Welthink Electronic Co., Ltd.",
https://tydz.en.alibaba.com/company_profile.html#top-nav-bar,"Foshan Teyuan Electronic Science & Technology Co., Ltd.",
https://shlipuzm.en.alibaba.com/company_profile.html#top-nav-bar,"Shanghai Lipu Lighting Co., Ltd.",4.6
https://shenming-growlight.en.alibaba.com/company_profile.html#top-nav-bar,"Shanghai Shenming Lighting Co., Ltd.",
https://hengxiong.en.alibaba.com/company_profile.html#top-nav-bar,"Wenzhou Hengxiong Electric Co., Ltd.",
https://bluesunpv.en.alibaba.com/company_profile.html#top-nav-bar,"Hefei Bluesun Solar Energy Tech. Co., Limited,Supplier",4.6
https://zjwealth.en.alibaba.com/company_profile.html#top-nav-bar,"Haining Wealth Electron Co., Ltd.",4.8
https://crpump.en.alibaba.com/company_profile.html#top-nav-bar,"Baoding Chuangrui Precision Pump Co., Ltd.,Supplier",4.8
https://cncsc.en.alibaba.com/company_profile.html#top-nav-bar,"Fujian Century Sea Power Co., Ltd.",4.6
https://gzfenlin.en.alibaba.com/company_profile.html#top-nav-bar,"Guangzhou Fenlin Swimming Pool & Sauna Equipment Co., Ltd.,Supplier",4.8
https://kshym.en.alibaba.com/company_profile.html#top-nav-bar,"Kunshan Huiyuan Trading Co., Ltd.",4.3
https://blooming-sprayer.en.alibaba.com/company_profile.html#top-nav-bar,"Yuyao Blooming Commodity Co., Ltd.",4.9
https://toption.en.alibaba.com/company_profile.html#top-nav-bar,"Xian Toption Instrument Co., Ltd.",5.0
https://sjzhf.en.alibaba.com/company_profile.html#top-nav-bar,"Shijiazhuang Houfeng Trading Co., Ltd.",4.9
https://sunflowersolar.en.alibaba.com/company_profile.html#top-nav-bar,"Changzhou 1st Sunflower Intelligence Technology Co., Ltd.",5.0
https://lantsun.en.alibaba.com/company_profile.html#top-nav-bar,,
https://cntriumph.en.alibaba.com/company_profile.html#top-nav-bar,"Hangzhou Triumph Imp And Exp Co., Ltd.,Supplier",5.0
https://cnfortek.en.alibaba.com/company_profile.html#top-nav-bar,"Hangzhou ForTek Electronics Co., Limited",4.8
https://szhixem.en.alibaba.com/company_profile.html#top-nav-bar,"Shenzhen Hixem Electronics Co., Ltd.",1.0
https://aescar.en.alibaba.com/company_profile.html#top-nav-bar,"Guangzhou AES Car Parts Co., Ltd.",
https://ugghid.en.alibaba.com/company_profile.html#top-nav-bar,"Guangzhou Shengda Electronic Co., Ltd.",4.9
https://liwin.en.alibaba.com/company_profile.html#top-nav-bar,"Guangzhou Liwin Electronic Technology Co., Ltd.",4.9
https://mhcarparts.en.alibaba.com/company_profile.html#top-nav-bar,Shenzhen Maihao Trading Company Limited,4.9
https://speedlight.en.alibaba.com/company_profile.html#top-nav-bar,"Guangzhou Kungfu Decoration Materials Co., Ltd.",4.7
https://dlxhkj.en.alibaba.com/company_profile.html#top-nav-bar,"Dalian Xinghai Technology Co., Ltd.",4.9
https://dsengineparts.en.alibaba.com/company_profile.html#top-nav-bar,"Shiyan Dongsu Industry & Trade Co., Ltd.,Supplier",5.0
https://superbattery.en.alibaba.com/company_profile.html#top-nav-bar,"Shenzhen SaiRi Battery Co., Ltd.",5.0
https://ledtubelight.en.alibaba.com/company_profile.html#top-nav-bar,,
https://hz-led.en.alibaba.com/company_profile.html#top-nav-bar,"Shenzhen Huazhong Lighting Co., Ltd.",
https://bwelectr.en.alibaba.com/company_profile.html#top-nav-bar,"Shenzhen Benwei Electronic Co., Ltd.",4.3
https://ahlr.en.alibaba.com/company_profile.html#top-nav-bar,"Anhui Lanrui Electronics Technology Co., Ltd.,Supplier",3.6
https://lvdengxia.en.alibaba.com/company_profile.html#top-nav-bar,"Meizhou Green Lantern Technology Co., Ltd.",4.7
https://chungxin.en.alibaba.com/company_profile.html#top-nav-bar,"Shenzhen Zhongxin Lighting Technology Co., Ltd.",5.0
https://sznumber.en.alibaba.com/company_profile.html#top-nav-bar,"Shenzhen Number Energy Saving Corporation,Supplier",5.0
https://csxldl.en.alibaba.com/company_profile.html#top-nav-bar,"Changsha StarLighting Co., Ltd.",5.0
https://snxin.en.alibaba.com/company_profile.html#top-nav-bar,"Jiangsu Shenxing Photoelectricity Medical Apparatus Co., Ltd.,Supplier",4.9
https://sunnyelectrical.en.alibaba.com/company_profile.html#top-nav-bar,"Wenzhou Sunny Electrical Co., Ltd.",
https://renownuv.en.alibaba.com/company_profile.html#top-nav-bar,,
https://shyitu.en.alibaba.com/company_profile.html#top-nav-bar,"Shanghai Yitu Electronic Technology Co., Ltd.",4.8
https://xyelectronics.en.alibaba.com/company_profile.html#top-nav-bar,"Jiangsu Deyi Xiangyu Optoelectronic Technology Co., Ltd.",0.0
https://hampool.en.alibaba.com/company_profile.html#top-nav-bar,"Shanghai Hampool Enterprise Co., Limited,Supplier",5.0
https://baotenlink.en.alibaba.com/company_profile.html#top-nav-bar,"Wenzhou Baoteng Electrical Co., Ltd.",5.0
https://tittrick01.en.alibaba.com/company_profile.html#top-nav-bar,"Shanghai Tittrick Electronic Technology Co., Ltd.,Supplier",
https://sentlon.en.alibaba.com/company_profile.html#top-nav-bar,Sentlon Auto Electric Sales Department (Guangzhou),4.9
https://bofit.en.alibaba.com/company_profile.html#top-nav-bar,"Zhuji Bofit Machinery Co., Ltd.",5.0
https://yqshicheng.en.alibaba.com/company_profile.html#top-nav-bar,"Yueqing Shicheng Power Technology Co., Ltd.",4.8
https://wubai.en.alibaba.com/company_profile.html#top-nav-bar,"Zhejiang Wubai Electric Power Fitting Co., Ltd.",4.9
https://gl-copper.en.alibaba.com/company_profile.html#top-nav-bar,,
https://htll.en.alibaba.com/company_profile.html#top-nav-bar,"Chengdu HTLL Technology Co., Ltd.",4.3
https://gdbosi.en.alibaba.com/company_profile.html#top-nav-bar,"Dongguan Bosi Hardware Electronic Co., Ltd.",5.0
https://baidadianqi.en.alibaba.com/company_profile.html#top-nav-bar,"Foshan Baida Electrical Co., Ltd.",5.0
https://flashcure.en.alibaba.com/company_profile.html#top-nav-bar,"Hebei Flash Cure Optoelectronic Technology Co., Ltd.",
https://txuv.en.alibaba.com/company_profile.html#top-nav-bar,"Hebei Flash Cure Optoelectronic Technology Co., Ltd.",
https://goldeneagle.en.alibaba.com/company_profile.html#top-nav-bar,"Dongguan Golden Eagle Coil Co., Ltd.",
https://zsouge.en.alibaba.com/company_profile.html#top-nav-bar,"Xuyi Ou Ge Electronic Co., Ltd.",5.0
https://cddzh.en.alibaba.com/company_profile.html#top-nav-bar,"Chengdu Dezhiheng Electronic Technology Co., Ltd.",5.0
https://lme.en.alibaba.com/company_profile.html#top-nav-bar,"Shenzhen LaiMan'er Technology Co., Ltd.",
https://mingyudacn.en.alibaba.com/company_profile.html#top-nav-bar,"Shenzhen Mingyuda Electronic Co., Ltd.",
https://zvepower.en.alibaba.com/company_profile.html#top-nav-bar,,
https://hkxx.en.alibaba.com/company_profile.html#top-nav-bar,"Shenzhen Sunkun Technology Co., Ltd.",0.0
https://dernfu.en.alibaba.com/company_profile.html#top-nav-bar,,
https://jysuokang.en.alibaba.com/company_profile.html#top-nav-bar,"Jiangyin Suokang Electricity Co., Ltd.",
https://uvbest.en.alibaba.com/company_profile.html#top-nav-bar,"Zhuozhou Best Technology Development Co., Ltd.",5.0
https://harvesttech.en.alibaba.com/company_profile.html#top-nav-bar,"Shenzhen Xinhemu Tech Co., Ltd.",
https://feilon.en.alibaba.com/company_profile.html#top-nav-bar,"Hefei Feilon Electronics Co., Limited",5.0
https://scrlt.en.alibaba.com/company_profile.html#top-nav-bar,"Foshan Sincere Electrical Appliance Co., Ltd.,Supplier",
https://sylstar.en.alibaba.com/company_profile.html#top-nav-bar,"Shanghai Sylstar Technology Co., Ltd.,Supplier",5.0
https://aguatop1.en.alibaba.com/company_profile.html#top-nav-bar,"Ningbo Shengyuan Electric Co., Ltd.",4.8
https://jshw.en.alibaba.com/company_profile.html#top-nav-bar,"Jiangsu Huawang Science&Technology Co., Ltd.",
https://jyasl.en.alibaba.com/company_profile.html#top-nav-bar,,
https://wjxinyu.en.alibaba.com/company_profile.html#top-nav-bar,"Suzhou Wujiang Xinyu Electrical Material Co., Ltd.",
https://wjzhongxin.en.alibaba.com/company_profile.html#top-nav-bar,Suzhou Zhongxin Electric Material Factory,
https://baoyuan168.en.alibaba.com/company_profile.html#top-nav-bar,"Foshan Baoyuan Electrical Material Co., Ltd.",
https://zjjhxl4.en.alibaba.com/company_profile.html#top-nav-bar,"Zhejiang Jiahui Wire And Cable Co., Ltd.",3.1
https://magnetwire.en.alibaba.com/company_profile.html#top-nav-bar,"Zhengzhou LP Industry Co., Ltd.",0.0
https://wjjzdcx.en.alibaba.com/company_profile.html#top-nav-bar,Wujiang Jinzheng Composite Materials Factory,
https://osmuntech.en.alibaba.com/company_profile.html#top-nav-bar,"Deqing Shenhong New Material Technology Co., Ltd.",
https://nbjhxl.en.alibaba.com/company_profile.html#top-nav-bar,"Zhejiang Jiahui Wire And Cable Co., Ltd.,Supplier",5.0
https://lightpoint.en.alibaba.com/company_profile.html#top-nav-bar,"Guangzhou Guangdian Automotive Electronics Co., Ltd.",4.2
https://opoolighting.en.alibaba.com/company_profile.html#top-nav-bar,"Guangzhou OPOO Electronic Technology Co., Ltd.",5.0
https://qdlima.en.alibaba.com/company_profile.html#top-nav-bar,"Qingdao Lima Lights Technology Co., Ltd.",5.0
https://chinapt.en.alibaba.com/company_profile.html#top-nav-bar,"Yiwu Power Tiger Auto Accessory Co., Ltd.",0.0
https://ulightcn.en.alibaba.com/company_profile.html#top-nav-bar,"LANSEKO (Guangzhou) Electronic Technology Co., Limited",4.9
https://ousipu.en.alibaba.com/company_profile.html#top-nav-bar,,
https://gzbestop.en.alibaba.com/company_profile.html#top-nav-bar,"Guangzhou Bestop Electronic Co., Ltd.",5.0
https://nssclighting.en.alibaba.com/company_profile.html#top-nav-bar,,
https://szautodragons.en.alibaba.com/company_profile.html#top-nav-bar,"Shenzhen Chengming Technologies Co., Ltd.,Supplier",4.9
https://cn-ss.en.alibaba.com/company_profile.html#top-nav-bar,"Guangzhou Merican Optoelectronic Technology Co., Ltd",4.9
https://sd-gaoneng.en.alibaba.com/company_profile.html#top-nav-bar,"Foshan Shunde Aozhong Lighting Co., Ltd.",
https://jmogl.en.alibaba.com/company_profile.html#top-nav-bar,"Jiangmen Ogjg Lighting And Electronic Co., Ltd.,Supplier",5.0
https://mlauto.en.alibaba.com/company_profile.html#top-nav-bar,"Guangzhou Milan Electronics Co., Ltd.",4.9
https://universelite.en.alibaba.com/company_profile.html#top-nav-bar,"Universelite Co., Ltd.",5.0
https://jsczpeide.en.alibaba.com/company_profile.html#top-nav-bar,"Changzhou Peide Water Treatment Equipment Co., Ltd.",5.0
https://labels.en.alibaba.com/company_profile.html#top-nav-bar,"Nanjing Yizhijin Garment Accessory Co., Ltd.",4.8
https://jarmoo-flag.en.alibaba.com/company_profile.html#top-nav-bar,"Wuhan Jarmoo Flag Co., Ltd.,Supplier",4.9
https://cncaps.en.alibaba.com/company_profile.html#top-nav-bar,"Hengxing Caps And Garments Co., Ltd.,Supplier",4.7
https://chinacap168.en.alibaba.com/company_profile.html#top-nav-bar,Yangxi Xiangli Caps & Bags Factory,5.0
https://qianzun88.en.alibaba.com/company_profile.html#top-nav-bar,"Baoding Qianzun Import And Export Co., Ltd.",4.8
https://yipaiartist.en.alibaba.com/company_profile.html#top-nav-bar,"Hangzhou Yipai Import & Export Trade Co., Ltd.",4.7
https://my1322489615lmyc.trustpass.alibaba.com/company_profile.html#top-nav-bar,TRADEPOINT ENTERPRISE SDN. BHD.,
https://yangyangsports.en.alibaba.com/company_profile.html#top-nav-bar,"Dongguan Yangyang Sporting Goods Co., Limited",4.5
https://sj-sun.en.alibaba.com/company_profile.html#top-nav-bar,"Hangzhou SJ Import & Export Co., Ltd.",4.7
https://caizhu.en.alibaba.com/company_profile.html#top-nav-bar,Guangzhou Caizhu Hardware Handicraft Article Factory,5.0
https://tops-gift.en.alibaba.com/company_profile.html#top-nav-bar,"Changsha Tops Crafts Co., Ltd.,Supplier",4.9
https://lianxingifts.en.alibaba.com/company_profile.html#top-nav-bar,"Zhongshan Xiaolan Lianxin Gifts&Arts Factory,Supplier",5.0
https://tops1.en.alibaba.com/company_profile.html#top-nav-bar,"Changsha Tops Crafts Co., Ltd.",5.0
https://unitedcrafts2013.en.alibaba.com/company_profile.html#top-nav-bar,"Yiwu Nide Gifts Co., Ltd.",3.6
https://cinhai.en.alibaba.com/company_profile.html#top-nav-bar,"Suzhou Boce Culture Promotion Gifts Co., Ltd.,Supplier",4.6
https://unitedcrafts.en.alibaba.com/company_profile.html#top-nav-bar,"Yiwu United Crafts Co., Ltd.",4.7
https://desent.en.alibaba.com/company_profile.html#top-nav-bar,"Hefei Desent International Trade Co., Ltd.,Supplier",4.9
https://gyancheng.en.alibaba.com/company_profile.html#top-nav-bar,"Zhaoqing Gaoyao Ancheng Silicone And Hardware Technology Co., Ltd.",4.9
https://gdruixin.en.alibaba.com/company_profile.html#top-nav-bar,Zhaoqing Gaoyao Ruilong Silicone Craft & Gifts Ltd.,4.8
https://choyi.en.alibaba.com/company_profile.html#top-nav-bar,Quanzhou Changyi Crafts Gifts Limited,4.7
https://lxgifts.en.alibaba.com/company_profile.html#top-nav-bar,Zhongshan Xiaolan Lianxin Gifts & Arts Factory,5.0
https://wristbandfamily.en.alibaba.com/company_profile.html#top-nav-bar,"Zhaoqing City Gaoyao District Jiafeng Silicone Products Co., Ltd.",4.7
https://siliconfactory.en.alibaba.com/company_profile.html#top-nav-bar,Shenzhen Baoan Shajing SpacePeak Silicone Products Factory,4.9
https://51bestsilicone.en.alibaba.com/company_profile.html#top-nav-bar,C&F Gifts Industrial Ltd.,5.0
https://winsungifts.en.alibaba.com/company_profile.html#top-nav-bar,"Winsun Imp. & Exp. Group Co., Ltd.",5.0
https://changshilipin.en.alibaba.com/company_profile.html#top-nav-bar,"Zhaoqing Gaoyao Changshi Metal Crafts Co., Ltd.",4.9
https://gudegift.en.alibaba.com/company_profile.html#top-nav-bar,"Hefei Gu De Garments Co., Ltd.",4.6
https://neworientalgift.en.alibaba.com/company_profile.html#top-nav-bar,"Neworiental Gift Co., Ltd.",4.9
https://tw-silicone.en.alibaba.com/company_profile.html#top-nav-bar,"Shenzhen Three Winner Silicone And Plastic Technology Co., Ltd.",4.9
https://szxinyin.en.alibaba.com/company_profile.html#top-nav-bar,"Shenzhen Xinyin Environment Rubber Product Co., Ltd.",4.9
https://zjwinsun.en.alibaba.com/company_profile.html#top-nav-bar,"Winsun Imp. & Exp. Group Co., Ltd.",
https://lianxingift.en.alibaba.com/company_profile.html#top-nav-bar,Gaoyao District Jindu Town Shilipai Hardware & Silicone Product Factory,4.7
https://dxpromotions.en.alibaba.com/company_profile.html#top-nav-bar,Fuzhou Dingxing Garment & Fashion Accessory Corp.,4.9
https://holywish.en.alibaba.com/company_profile.html#top-nav-bar,"Guangzhou Holywish Promo Gift Co., Ltd.",4.9
https://bagsmaker.en.alibaba.com/company_profile.html#top-nav-bar,"Quanzhou Ruisheng Bags Co., Ltd.",
https://cndeqi.en.alibaba.com/company_profile.html#top-nav-bar,"Yiwu Deqi Bag & Case Co., Ltd.,Supplier",5.0
https://daydance.en.alibaba.com/company_profile.html#top-nav-bar,"Shenzhen DanceBeauty Clothing Co., Ltd.,Supplier",4.9
https://everspringbags.en.alibaba.com/company_profile.html#top-nav-bar,"Quanzhou Ever Spring Bags Co., Ltd.",4.8
https://eachone.en.alibaba.com/company_profile.html#top-nav-bar,"Xiamen Eachone Industrial Co., Ltd.",5.0
https://sproutjewel.en.alibaba.com/company_profile.html#top-nav-bar,"Yiwu Canrui Jewelry Co., Ltd.",4.0
https://jiefachina.en.alibaba.com/company_profile.html#top-nav-bar,"Hangzhou Jiefa Materials Co., Ltd.",4.9
https://hstyle.en.alibaba.com/company_profile.html#top-nav-bar,"Fuzhou K&T Information Technology Co., Ltd.",4.9
https://papermanufactures.en.alibaba.com/company_profile.html#top-nav-bar,"Xiamen Stone Industrial And Trading Co., Ltd.",4.6
https://ownerparty.en.alibaba.com/company_profile.html#top-nav-bar,"Hangzhou Owner Party Co., Ltd.",4.9
https://myhf.en.alibaba.com/company_profile.html#top-nav-bar,"Yangzhou Sailing Trade Co., Ltd.",0.0
https://yzzxwj.en.alibaba.com/company_profile.html#top-nav-bar,"Yangzhou Zhongxi Plush Toys Gift Co., Ltd.",5.0
https://tgtoys.en.alibaba.com/company_profile.html#top-nav-bar,Yizheng Tianguan Handicraft Factory,5.0
https://mimotoy.en.alibaba.com/company_profile.html#top-nav-bar,"Yiwu Mimo Trading Co., Ltd.",4.7
https://lenora.en.alibaba.com/company_profile.html#top-nav-bar,"Yiwu Lenora Trading Co., Ltd.",5.0
https://yzjingmei.en.alibaba.com/company_profile.html#top-nav-bar,"Yangzhou New Sunrise Arts & Crafts Co., Ltd.",0.0
https://levintoys.en.alibaba.com/company_profile.html#top-nav-bar,"Shenzhen Levin Plush Toys Co., Ltd.",5.0
https://babytoys.en.alibaba.com/company_profile.html#top-nav-bar,"Shenzhen Mingsenxing Toy Gift Co., Ltd.,Supplier",4.8
https://nantongopera.en.alibaba.com/company_profile.html#top-nav-bar,"Nantong Opera Imp. & Exp. Co., Ltd.",
https://gotgift.en.alibaba.com/company_profile.html#top-nav-bar,"Shanghai Got Gift Co., Ltd.",4.7
https://xmmelody.en.alibaba.com/company_profile.html#top-nav-bar,"Xiamen Melody Art & Craft Co., Ltd.,Supplier",5.0
https://crystocraft.en.alibaba.com/company_profile.html#top-nav-bar,UNITED ART METALS FACTORY LIMITED,5.0
https://cnworth.en.alibaba.com/company_profile.html#top-nav-bar,"Cangnan Worth Arts And Crafts Co., Ltd.,Supplier",4.5
https://shicheng.en.alibaba.com/company_profile.html#top-nav-bar,"Shantou Shicheng Arts & Crafts Co., Ltd.",5.0
https://eresources.en.alibaba.com/company_profile.html#top-nav-bar,"Shanghai Eastern Resources Arts & Crafts Co., Ltd.,Supplier",5.0
https://jayi-display.en.alibaba.com/company_profile.html#top-nav-bar,"Huizhou Jayi Display Co., Ltd.",5.0
https://taiyicraft.en.alibaba.com/company_profile.html#top-nav-bar,Taizhou Taiyi Craft Factory (General Partnership),5.0
https://gqstoys.en.alibaba.com/company_profile.html#top-nav-bar,Shantou Chenghai Guang Qi Sheng Toys Firm,4.9
https://abangda.en.alibaba.com/company_profile.html#top-nav-bar,"Shenzhen Maijiada Technology Co., Ltd.",4.7
https://yzklxy.en.alibaba.com/company_profile.html#top-nav-bar,"Yangzhou Kailai Footwear & Packaging Co., Ltd.",5.0
https://nicecin168.en.alibaba.com/company_profile.html#top-nav-bar,"Fuzhou Yongping Footwear Co., Ltd.",5.0
https://klco.en.alibaba.com/company_profile.html#top-nav-bar,"Fuzhou Xinhongfan International Trade Co., Ltd.",5.0
https://grandfaith.en.alibaba.com/company_profile.html#top-nav-bar,Hangzhou Kuntai Trading Limited,0.0
https://jasonfootwear.en.alibaba.com/company_profile.html#top-nav-bar,"Hangzhou Jason Trading Co., Ltd.,Supplier",4.7
https://dcharmshoes.en.alibaba.com/company_profile.html#top-nav-bar,"Quanzhou Ding Chen Charm Trading Co., Ltd.",4.9
https://candoshoes.en.alibaba.com/company_profile.html#top-nav-bar,,
https://gdczhy.en.alibaba.com/company_profile.html#top-nav-bar,"Guangdong Huayuan Leather Plastic Technology Co., Ltd.",
https://simblecn.en.alibaba.com/company_profile.html#top-nav-bar,"Quanzhou Simble Import And Export Trading Co., Ltd.",5.0
https://weihongshoes.en.alibaba.com/company_profile.html#top-nav-bar,"Hangzhou Vitality Industrial Co., Ltd.",
https://esatoys.en.alibaba.com/company_profile.html#top-nav-bar,"Wenzhou Times Arts&crafts Co., Ltd.,Supplier",4.8
https://keansilicon.en.alibaba.com/company_profile.html#top-nav-bar,"Shenzhen Kean Silicone Product Co., Ltd.,Supplier",4.9
https://cnxuda.en.alibaba.com/company_profile.html#top-nav-bar,,
https://levincrafts.en.alibaba.com/company_profile.html#top-nav-bar,"Shenzhen Levin Toys & Gifts Co., Limited",5.0
https://yk2008china.en.alibaba.com/company_profile.html#top-nav-bar,"Dongguan Yuan Kang Plush Toys Co., Ltd.,Supplier",4.7
https://bestgoalchina.en.alibaba.com/company_profile.html#top-nav-bar,"BestGoal (Shanghai) Manufacture Co., Ltd.,Supplier",5.0
https://dolphineshow.en.alibaba.com/company_profile.html#top-nav-bar,"Yiwu Dolphineshow Trading Co., Ltd.,Supplier",4.9
https://xiangtaigifts.en.alibaba.com/company_profile.html#top-nav-bar,"Quanzhou Licheng Xiangtai Gifts Co., Ltd.,Supplier",4.7
https://yolite365.en.alibaba.com/company_profile.html#top-nav-bar,"Yuyao Ke'an Reflective Products Co., Ltd.",4.9
https://jinyufootwear.en.alibaba.com/company_profile.html#top-nav-bar,"Xiamen Jinyu Imp. & Exp. Trading Co., Ltd.",5.0
https://yzhuibo.en.alibaba.com/company_profile.html#top-nav-bar,"Yangzhou HuiBo Shoes Co., Ltd.",5.0
https://cnsunnyway.en.alibaba.com/company_profile.html#top-nav-bar,"Yiwu Sunny Way Import And Export Co., Ltd.",4.3
